#,Keyword,Intent,Volume,KD %,CPC (USD)
1720,"is 5 ft a vastu diemension",n/a,0,n/a,0.00
1721,"is 5 stairs good as per vastu",n/a,0,n/a,0.00
1722,"is 6 fishes lucky accoding to vastu",n/a,0,n/a,0.00
1723,"is 8.5 feet is vastu",n/a,0,n/a,0.00
1724,"is a plot with road on east good vastu",n/a,0,n/a,0.00
1725,"is adreno flat in amanora are vastu compliant",n/a,0,n/a,0.00
1726,"is aerica palm tree good for vastu",n/a,0,n/a,0.00
1727,"is aloe vera a vastu plant",n/a,0,n/a,0.00
1728,"is altamonte malad east vastu compliant",n/a,0,n/a,0.00
1729,"is animal painting according to vastu in homes",n/a,0,n/a,0.00
1730,"is animals are also affected according to vastu",n/a,0,n/a,0.00
1731,"is anticlockwise staircase good for vastu",n/a,0,n/a,0.00
1732,"is arecca palm vastu plant",n/a,0,n/a,0.00
1733,"is attach bathroom good vastu",n/a,0,n/a,0.00
1734,"is babool good according vastu",n/a,0,n/a,0.00
1735,"is balcony portion of house as per vastu",n/a,0,n/a,0.00
1736,"is bathroom attached with kichen in correct as per vastu",n/a,0,n/a,0.00
1737,"is beagle dog good for vastu shastra",n/a,0,n/a,0.00
1738,"is bed room size11ft x13.5 ft fit as per vastu",n/a,0,n/a,0.00
1739,"is bed with storage good for vastu",n/a,0,n/a,0.00
1740,"is black color wood good for temple vastu",n/a,0,n/a,0.00
1741,"is black wall clock correct as per vastu",n/a,0,n/a,0.00
1742,"is blue color good for living room vastu",n/a,0,n/a,0.00
1743,"is bonsai good for room as per vastu",n/a,0,n/a,0.00
1744,"is bunck bed is good according to vastu",n/a,0,n/a,0.00
1745,"is butterfly sticker is bad according to vastu",n/a,0,n/a,0.00
1746,"is buying second hand house good as per vastu",n/a,0,n/a,0.00
1747,"is carrying milk to work wrong as per vastu shastra",n/a,0,n/a,0.00
1748,"is cat good for home vastu",n/a,0,n/a,0.00
1749,"is chembakam tree for vastu dosha",n/a,0,n/a,0.00
1750,"is chiili plant good in home as per vastu",n/a,0,n/a,0.00
1751,"is chilli plant good in home as per vastu",n/a,0,n/a,0.00
1752,"is cleaning of office in evening wrong vastu",n/a,0,n/a,0.00
1753,"is colour of home as per vastu",n/a,0,n/a,0.00
1754,"is concrete bed good according to vastu",n/a,0,n/a,0.00
1755,"is creeper not good for home as per vastu",n/a,0,n/a,0.00
1756,"is degree calculation must in vastu",n/a,0,n/a,0.00
1757,"is dog good for vastu in hindi",n/a,0,n/a,0.00
1758,"is door intersect each other is good as per vastu",n/a,0,n/a,0.00
1759,"is double door flats right as per vastu",n/a,0,n/a,0.00
1760,"is dwarf banyan tree good according to vastu shastra",n/a,0,n/a,0.00
1761,"is dwarf coconut good to plant according to vastu",n/a,0,n/a,0.00
1762,"is dwarf date palm good for homes according to vastu",n/a,0,n/a,0.00
1763,"is east facing house good according to vastu",n/a,0,n/a,0.00
1764,"is east facing house good in vastu",n/a,0,n/a,0.00
1765,"is east of south east entrance as per vastu",n/a,0,n/a,0.00
1766,"is east of south east entrance for as per vastu",n/a,0,n/a,0.00
1767,"is east south east facing house in vastu",n/a,0,n/a,0.00
1768,"is fish good for hoem vastu",n/a,0,n/a,0.00
1769,"is french door considered as door as per vastu",n/a,0,n/a,0.00
1770,"is galloping horse with sunset good as per vastu",n/a,0,n/a,0.00
1771,"is gifting rabbit good for vastu",n/a,0,n/a,0.00
1772,"is green colour in bedroom as vastu",n/a,0,n/a,0.00
1773,"is green on study table good as per vastu",n/a,0,n/a,0.00
1774,"is gudhal flower plant is good for house vastu",n/a,0,n/a,0.00
1775,"is gudhal plant is good for house vastu",n/a,0,n/a,0.00
1776,"is guest bedroom in north side ok as per vastu",n/a,0,n/a,0.00
1777,"is hibiscus flower plant is good for house vastu",n/a,0,n/a,0.00
1778,"is horse doll for vastu",n/a,0,n/a,0.00
1779,"is horse vastu good",n/a,0,n/a,0.00
1780,"is iron gate in good main door for vastu",n/a,0,n/a,0.00
1781,"is iron gate included in vastu shastra",n/a,0,n/a,0.00
1782,"is it good falcon entering the house as per vastu",n/a,0,n/a,0.00
1783,"is it good to gift lamp according to vastu",n/a,0,n/a,0.00
1784,"is it good to have sex on birthday in vastu",n/a,0,n/a,0.00
1785,"is it good to.play pagade at home vastu",n/a,0,n/a,0.00
1786,"is it important to check vastu for flats",n/a,0,n/a,0.00
1787,"is it mandatory to fallow vastu while building house",n/a,0,n/a,0.00
1788,"is it necessary to see vastu for rented houses",n/a,0,n/a,0.00
1789,"is it ok 3 burner stove vastu",n/a,0,n/a,0.00
1790,"is it ok to construct house at tiraha by vastu",n/a,0,n/a,0.00
1791,"is it ok to construct house at tiraha from vastu",n/a,0,n/a,0.00
1792,"is it ok to have storage above bed vastu",n/a,0,n/a,0.00
1793,"is it ok to put vastu purusha photo at home",n/a,0,n/a,0.00
1794,"is it possible to have vastu consulted houses",n/a,0,n/a,0.00
1795,"is it right to have vastu on new moon days",n/a,0,n/a,0.00
1796,"is it right to study on bed as per vastu",n/a,0,n/a,0.00
1797,"is it vastu exist",n/a,0,n/a,0.00
1798,"is jain vastu different from others",n/a,0,n/a,0.00
1799,"is jhulelal god of vastu",n/a,0,n/a,0.00
1800,"is kitchen cooking counter facing north direction vastu",n/a,0,n/a,0.00
1801,"is magarpatta annexe vastu compliant",n/a,0,n/a,0.00
1802,"is magarpatta vastu compliant",n/a,0,n/a,0.00
1803,"is mahindra windchimes vastu compliant",n/a,0,n/a,0.00
1804,"is mandatory of vastu conversion for bank loan",n/a,0,n/a,0.00
1805,"is mandatory of vastu for bank loan",n/a,0,n/a,0.00
1806,"is mango tree good for vastu",n/a,0,n/a,0.00
1807,"is mango tree good for vastu in tamil",n/a,0,n/a,0.00
1808,"is marua plant good for home vastu ke dreshti se",n/a,0,n/a,0.00
1809,"is mirror suitable on south wall according to vastu",n/a,0,n/a,0.00
1810,"is my date of birth important to get hired vastu",n/a,0,n/a,0.00
1811,"is name plate important in vastu",n/a,0,n/a,0.00
1812,"is nanu spana habita is vastu compliance",n/a,0,n/a,0.00
1813,"is negative vastu a reason for cancer",n/a,0,n/a,0.00
1814,"is north east directiongood for master bedroom as per vastu",n/a,0,n/a,0.00
1815,"is north east facing of toilet good as per vastu",n/a,0,n/a,0.00
1816,"is north east is good vastu direction for cooking gas",n/a,0,n/a,0.00
1817,"is north east kitchen is good as per vastu",n/a,0,n/a,0.00
1818,"is north east vastu elongation good",n/a,0,n/a,0.00
1819,"is north west kitchen good for vastu",n/a,0,n/a,0.00
1820,"is northeast facing plot vastu compliant",n/a,0,n/a,0.00
1821,"is numerology and vastu same",n/a,0,n/a,0.00
1822,"is olive cressida vastu compliant",n/a,0,n/a,0.00
1823,"is out door stair case has to comes under vastu",n/a,0,n/a,0.00
1824,"is painting of running horses vastu",n/a,0,n/a,0.00
1825,"is patabahari tree auspicious for vastu",n/a,0,n/a,0.00
1826,"is pebbles on home garden good according to vastu",n/a,0,n/a,0.00
1827,"is pebbles on home good according to vastu",n/a,0,n/a,0.00
1828,"is photo 6 vastu nayi h",n/a,0,n/a,0.00
1829,"is photo m 6 vastu aisi h",n/a,0,n/a,0.00
1830,"is photo me 6 aisi vastu he jo purane jamane",n/a,0,n/a,0.00
1831,"is photo me 6 vastu aisi",n/a,0,n/a,0.00
1832,"is pigeon eating food bad as per vastu",n/a,0,n/a,0.00
1833,"is pink color vastu",n/a,0,n/a,0.00
1834,"is planten tree bad for vastu",n/a,0,n/a,0.00
1835,"is plot vastu beluef or science",n/a,0,n/a,0.00
1836,"is purple color good for bedroom as per vastu",n/a,0,n/a,0.00
1837,"is putting roaring tiger pic heals vastu defect of toilet",n/a,0,n/a,0.00
1838,"is raat ki rani a bad vastu plant",n/a,0,n/a,0.00
1839,"is rabbit good for vastu in hindi",n/a,0,n/a,0.00
1840,"is radha krishna photo good in bedroom vastu",n/a,0,n/a,0.00
1841,"is rakta chandan ised for vastu",n/a,0,n/a,0.00
1842,"is red light good for bedroom as per vastu",n/a,0,n/a,0.00
1843,"is rubber plant lucky as per vastu",n/a,0,n/a,0.00
1844,"is runt pegion is good for vastu",n/a,0,n/a,0.00
1845,"is sahjan tree vastu",n/a,0,n/a,0.00
1846,"is sahjana tree is good as per vastu",n/a,0,n/a,0.00
1847,"is saral vastu fake",n/a,0,n/a,0.00
1848,"is sarala vastu works",n/a,0,n/a,0.00
1849,"is sissoo wood vastu wise ok",n/a,0,n/a,0.00
1850,"is skull decor good as per vastu",n/a,0,n/a,0.00
1851,"is slanted pop good for children as per vastu",n/a,0,n/a,0.00
1852,"is sleeping on iron containing bed related with vastu dosh",n/a,0,n/a,0.00
1853,"is slope towards south considered inauspicious in vastu shastra",n/a,0,n/a,0.00
1854,"is snail is not good according to vastu for home",n/a,0,n/a,0.00
1855,"is snn raj serenity vastu compliant",n/a,0,n/a,0.00
1856,"is south bedroom vastu good",n/a,0,n/a,0.00
1857,"is south bedroom vastu good as per vastu",n/a,0,n/a,0.00
1858,"is south east balcony good according to vastu",n/a,0,n/a,0.00
1859,"is south east facing propert good according to vastu",n/a,0,n/a,0.00
1860,"is south east toilet good as per vastu",n/a,0,n/a,0.00
1861,"is south east toilet good as per vastu for office",n/a,0,n/a,0.00
1862,"is south exit from house in vastu",n/a,0,n/a,0.00
1863,"is south facing flat vastu compliant",n/a,0,n/a,0.00
1864,"is south facing house entry good according to vastu",n/a,0,n/a,0.00
1865,"is south side main entrance is good as per vastu",n/a,0,n/a,0.00
1866,"is southfacing house good as per vastu",n/a,0,n/a,0.00
1867,"is spiral staircase good in the house according to vastu",n/a,0,n/a,0.00
1868,"is square wall clock is good according to vastu",n/a,0,n/a,0.00
1869,"is staircase in front of main door vastu",n/a,0,n/a,0.00
1870,"is sukur enclave c kasarvadavali is vastu compliant",n/a,0,n/a,0.00
1871,"is sunday is good for vastu",n/a,0,n/a,0.00
1872,"is sunset poster good for vastu",n/a,0,n/a,0.00
1873,"is teady bear good for home as per vastu",n/a,0,n/a,0.00
1874,"is temple in front of main door vastu compliant",n/a,0,n/a,0.00
1875,"is the any vastu effect of mastubation",n/a,0,n/a,0.00
1876,"is the swimming pool inside the house good for vastu",n/a,0,n/a,0.00
1877,"is the vastu shastra benefits for new home",n/a,0,n/a,0.00
1878,"is there a temple for vastu in south india",n/a,0,n/a,0.00
1879,"is there a vastu place to keep coconut tree",n/a,0,n/a,0.00
1880,"is there an alternative to vastu shanta pooja",n/a,0,n/a,0.00
1881,"is there an alternative to vastu shanti pooja",n/a,0,n/a,0.00
1882,"is there any importance for trees in vastu",n/a,0,n/a,0.00
1883,"is there any reason for arthritis due to vastu dos",n/a,0,n/a,0.00
1884,"is there any remedy.for north radt elevation under vastu",n/a,0,n/a,0.00
1885,"is there any requirement for room vastu sizes",n/a,0,n/a,0.00
1886,"is there any truth in vastu shastra",n/a,0,n/a,0.00
1887,"is there any vastu for main door in cross",n/a,0,n/a,0.00
1888,"is there any vastu shastra for america",n/a,0,n/a,0.00
1889,"is there vastu of property",n/a,0,n/a,0.00
1890,"is there vastu of property towards south",n/a,0,n/a,0.00
1891,"is three fold main gate vastu compliant",n/a,0,n/a,0.00
1892,"is tiger pictures kept in bedroom for vastu",n/a,0,n/a,0.00
1893,"is tijori perfect in south east corner acc to vastu",n/a,0,n/a,0.00
1894,"is to good to buy 6.5 cents land vastu",n/a,0,n/a,0.00
1895,"is toilet in east good as per vastu",n/a,0,n/a,0.00
1896,"is turtle good for vastu at home",n/a,0,n/a,0.00
1897,"is tv in dining room good vastu",n/a,0,n/a,0.00
1898,"is using pure leather purse advisable as per vastu",n/a,0,n/a,0.00
1899,"is vastu a proven science",n/a,0,n/a,0.00
1900,"is vastu a science or superstition",n/a,0,n/a,0.00
1901,"is vastu a superstition",n/a,0,n/a,0.00
1902,"is vastu applicable for agricultural land also",n/a,0,n/a,0.00
1903,"is vastu applicable for flat for rent",n/a,0,n/a,0.00
1904,"is vastu applicable for tenants",n/a,0,n/a,0.00
1905,"is vastu applicable in uk",n/a,0,n/a,0.00
1906,"is vastu apply for square shape or rectangle shape",n/a,0,n/a,0.00
1907,"is vastu as per name real",n/a,0,n/a,0.00
1908,"is vastu bigger than god",n/a,0,n/a,0.00
1909,"is vastu bogus",n/a,0,n/a,0.00
1910,"is vastu considered for individual rooms or the whole house",n/a,0,n/a,0.00
1911,"is vastu consultancy service a tax deductible exoense",n/a,0,n/a,0.00
1912,"is vastu courses offered by aifas are put for legally",n/a,0,n/a,0.00
1913,"is vastu different for different people",n/a,0,n/a,0.00
1914,"is vastu dimension measured from main door",n/a,0,n/a,0.00
1915,"is vastu followed in bhagavad gita",n/a,0,n/a,0.00
1916,"is vastu for tenants or owners",n/a,0,n/a,0.00
1917,"is vastu imp sadhguru",n/a,0,n/a,0.00
1918,"is vastu important before purchasing a flat",n/a,0,n/a,0.00
1919,"is vastu items liable for gst",n/a,0,n/a,0.00
1920,"is vastu kala academy government",n/a,0,n/a,0.00
1921,"is vastu kala academy govt",n/a,0,n/a,0.00
1922,"is vastu necessary for rented houses",n/a,0,n/a,0.00
1923,"is vastu necessary for septic tank",n/a,0,n/a,0.00
1924,"is vastu pada calculation",n/a,0,n/a,0.00
1925,"is vastu pada of house length or plot length",n/a,0,n/a,0.00
1926,"is vastu practiced in modern architecture",n/a,0,n/a,0.00
1927,"is vastu product give result",n/a,0,n/a,0.00
1928,"is vastu really important in usa",n/a,0,n/a,0.00
1929,"is vastu sashtra relevant",n/a,0,n/a,0.00
1930,"is vastu scientific or stpud",n/a,0,n/a,0.00
1931,"is vastu scientific or stud",n/a,0,n/a,0.00
1932,"is vastu shanta done in a flat",n/a,0,n/a,0.00
1933,"is vastu shastra a myth",n/a,0,n/a,0.00
1934,"is vastu shastra dravidian",n/a,0,n/a,0.00
1935,"is vastu shastra in southern hemisphere",n/a,0,n/a,0.00
1936,"is vastu shastra link with maths",n/a,0,n/a,0.00
1937,"is vastu shastra relevant",n/a,0,n/a,0.00
1938,"is vastu shastra required",n/a,0,n/a,0.00
1939,"is vastu shastra required for small plots",n/a,0,n/a,0.00
1940,"is vastu the traditional architecture",n/a,0,n/a,0.00
1941,"is vastu true for flata",n/a,0,n/a,0.00
1942,"is vastu true for flats",n/a,0,n/a,0.00
1943,"is vastu true for rented houses",n/a,0,n/a,0.00
1944,"is vastu true quora",n/a,0,n/a,0.00
1945,"is vastu very important",n/a,0,n/a,0.00
1946,"is vastu vihar apartment is good",n/a,0,n/a,0.00
1947,"is vastu vihar give best house",n/a,0,n/a,0.00
1948,"is wall behind working table good as per vastu",n/a,0,n/a,0.00
1949,"is water feature in south west corner acceptable according vastu",n/a,0,n/a,0.00
1950,"is water turtle good as per vastu",n/a,0,n/a,0.00
1951,"is wenge color good for temple vastu",n/a,0,n/a,0.00
1952,"is west entrance good as per vastu for office",n/a,0,n/a,0.00
1953,"is west facing house good per indian vastu",n/a,0,n/a,0.00
1954,"is white paint inside house good as per vastu",n/a,0,n/a,0.00
1955,"is wood good as per vastu",n/a,0,n/a,0.00
1956,"is your home interior free from vastu complaints",n/a,0,n/a,0.00
1957,"must have trees at home indian vastu",n/a,0,n/a,0.00
1958,"must read books for vastu",n/a,0,n/a,0.00
1959,"should a house have a basement vastu",n/a,0,n/a,0.00
1960,"should a plot be a square according to vastu",n/a,0,n/a,0.00
1961,"should all doors move clockwise as per vastu",n/a,0,n/a,0.00
1962,"should any door be anti clockwise as per vastu",n/a,0,n/a,0.00
1963,"should bathroom door be kept closed according to vastu",n/a,0,n/a,0.00
1964,"should be toilet in northeast in vastu",n/a,0,n/a,0.00
1965,"should bed room b in black colour acc to vastu",n/a,0,n/a,0.00
1966,"should boyfriend not buy wig vastu",n/a,0,n/a,0.00
1967,"should christians follow vastu",n/a,0,n/a,0.00
1968,"should fighter fish be kept at home vastu",n/a,0,n/a,0.00
1969,"should flying hanumanji be at home vastu",n/a,0,n/a,0.00
1970,"should head be against a wall vastu",n/a,0,n/a,0.00
1971,"should house owner stay on top floor vastu",n/a,0,n/a,0.00
1972,"should i believe in vastu sadhguru",n/a,0,n/a,0.00
1973,"should i follow vastu sastra for my new home",n/a,0,n/a,0.00
1974,"should i have a sex in the lake vastu",n/a,0,n/a,0.00
1975,"should i look for vastu before purchasing a flat",n/a,0,n/a,0.00
1976,"should i plant banana tree at home vastu",n/a,0,n/a,0.00
1977,"should internal opposite doors be aligned as per vastu",n/a,0,n/a,0.00
1978,"should not sleep keeping your hand over heart vastu",n/a,0,n/a,0.00
1979,"should south be at vastu",n/a,0,n/a,0.00
1980,"should the be clock in bathroom as per vastu",n/a,0,n/a,0.00
1981,"should toilet tank beneath stair vastu",n/a,0,n/a,0.00
1982,"should use glass or acrylic in windows as per vastu",n/a,0,n/a,0.00
1983,"should we consider vastu in usa",n/a,0,n/a,0.00
1984,"should we consider vastu shastra for farmhouse",n/a,0,n/a,0.00
1985,"should we gift watch as per vastu",n/a,0,n/a,0.00
1986,"should we keep main entrance under staircase vastu",n/a,0,n/a,0.00
1987,"should we put stair at center of house vastu",n/a,0,n/a,0.00
1988,"should we use bamboo utensils in kitchen vastu",n/a,0,n/a,0.00
1989,"should you sleep in front of bedroom door vastu",n/a,0,n/a,0.00
1990,"was singapore built on vastu",n/a,0,n/a,0.00
1991,"were to keep images of dolls according to vastu",n/a,0,n/a,0.00
1992,"were to place vastu show piece fish statue at home",n/a,0,n/a,0.00
1993,"were toputdolls images according to vastu",n/a,0,n/a,0.00
1994,"were waste water can go according to vastu",n/a,0,n/a,0.00
1995,"what about andal vastu p.chockalingam",n/a,0,n/a,0.00
1996,"what about north west facing plot vastu",n/a,0,n/a,0.00
1997,"what all vastu fish aquarium at home in hindi",n/a,0,n/a,0.00
1998,"what are basic vastu tips",n/a,0,n/a,0.00
1999,"what are earth elements in vastu",n/a,0,n/a,0.00
2000,"what are sleeping positions as per vastu",n/a,0,n/a,0.00
2001,"what are sleeping postions as per vastu",n/a,0,n/a,0.00
2002,"what are some good posters for prosperity according to vastu",n/a,0,n/a,0.00
2003,"what are the basic things to learn vastu",n/a,0,n/a,0.00
2004,"what are the basic vastu for east facing house",n/a,0,n/a,0.00
2005,"what are the basic vastu principles",n/a,0,n/a,0.00
2006,"what are the good perimeters in kerala vastu perimeter",n/a,0,n/a,0.00
2007,"what are the main points of vastu",n/a,0,n/a,0.00
2008,"what are the moolas in vastu",n/a,0,n/a,0.00
2009,"what are the remedies for south west toilet vastu",n/a,0,n/a,0.00
2010,"what are the rules to buy car as per vastu",n/a,0,n/a,0.00
2011,"what are the standards for pyramids as per vastu",n/a,0,n/a,0.00
2012,"what are the vastu fishes",n/a,0,n/a,0.00
2013,"what are the vastu for 26x42 west facing house",n/a,0,n/a,0.00
2014,"what are the vastu idols in office desk",n/a,0,n/a,0.00
2015,"what are the vastu rules for balcony",n/a,0,n/a,0.00
2016,"what are the vastu tips for tower in the building",n/a,0,n/a,0.00
2017,"what are vastu dosh",n/a,0,n/a,0.00
2018,"what are vastu tips for good performance of classifiers",n/a,0,n/a,0.00
2019,"what can be above pooja as per vastu",n/a,0,n/a,0.00
2020,"what can be kept in kanimulai as per vastu",n/a,0,n/a,0.00
2021,"what can be kept under stairs vastu",n/a,0,n/a,0.00
2022,"what can be placed above door according to vastu",n/a,0,n/a,0.00
2023,"what can be placed above inside door according to vastu",n/a,0,n/a,0.00
2024,"what can be placed above kitchen door according to vastu",n/a,0,n/a,0.00
2025,"what can be stored under staircase as per vastu",n/a,0,n/a,0.00
2026,"what can be vastu dosh for having cold",n/a,0,n/a,0.00
2027,"what color for day girls according to vastu",n/a,0,n/a,0.00
2028,"what color kitchen should i get as per vastu",n/a,0,n/a,0.00
2029,"what color wall paper is vastu compliant for kids room",n/a,0,n/a,0.00
2030,"what color wallet attracts money according to vastu",n/a,0,n/a,0.00
2031,"what color wallet is lucky anandi vastu",n/a,0,n/a,0.00
2032,"what colors good for kitchen vastu",n/a,0,n/a,0.00
2033,"what colors to avoid in home as per vastu",n/a,0,n/a,0.00
2034,"what colour is suitable for fitness as per vastu",n/a,0,n/a,0.00
2035,"what colour is sutible for fitess as per vastu",n/a,0,n/a,0.00
2036,"what colour to wear on saturday according to vastu",n/a,0,n/a,0.00
2037,"what colours shud b in master bedroom acc to vastu",n/a,0,n/a,0.00
2038,"what did vastu housing finance do before 2015",n/a,0,n/a,0.00
2039,"what direction entrance of house according to vastu",n/a,0,n/a,0.00
2040,"what direction of computer as per vastu",n/a,0,n/a,0.00
2041,"what direction should your bed face vastu",n/a,0,n/a,0.00
2042,"what do vastu says about the location of stp tank",n/a,0,n/a,0.00
2043,"what do you mean by vastu compliant",n/a,0,n/a,0.00
2044,"what does bible tells about vastu shastra",n/a,0,n/a,0.00
2045,"what does black colour signify as per vastu",n/a,0,n/a,0.00
2046,"what does brahma sthan means in vastu",n/a,0,n/a,0.00
2047,"what does fire related problems means as per vastu",n/a,0,n/a,0.00
2048,"what does green red yellow light in office in vastu",n/a,0,n/a,0.00
2049,"what does house facing mean in vastu",n/a,0,n/a,0.00
2050,"what does implies north-east corner in vastu",n/a,0,n/a,0.00
2051,"what does it mean by nikshep or vastu purush",n/a,0,n/a,0.00
2052,"what does red roses symbolize as per vastu",n/a,0,n/a,0.00
2053,"what does round door means in vastu shastra",n/a,0,n/a,0.00
2054,"what does vastu stand for",n/a,0,n/a,0.00
2055,"what dress would be worn in vastu poojan",n/a,0,n/a,0.00
2056,"what face cashbox vastu tamil",n/a,0,n/a,0.00
2057,"what facing of toilet seat as per vastu",n/a,0,n/a,0.00
2058,"what facing should be the pooja room as per vastu",n/a,0,n/a,0.00
2059,"what fish should be kept in aquarium as per vastu",n/a,0,n/a,0.00
2060,"what geopathic vastu services in delhi",n/a,0,n/a,0.00
2061,"what happen if wardrobe in east as per vastu",n/a,0,n/a,0.00
2062,"what happens at 930 am in vastu shastra",n/a,0,n/a,0.00
2063,"what happens if vastu purush is removed",n/a,0,n/a,0.00
2064,"what happens if we dint build house without proper vastu",n/a,0,n/a,0.00
2065,"what happens in west facing cooking in vastu",n/a,0,n/a,0.00
2066,"what happens when we do not go by vastu",n/a,0,n/a,0.00
2067,"what if dining table shape is round vastu",n/a,0,n/a,0.00
2068,"what if garden in south facing as per vastu",n/a,0,n/a,0.00
2069,"what if milk ll b poured on floor vastu",n/a,0,n/a,0.00
2070,"what if roof of south east not closed vastu",n/a,0,n/a,0.00
2071,"what if south east not closed vastu",n/a,0,n/a,0.00
2072,"what if the house facing toward south as per vastu",n/a,0,n/a,0.00
2073,"what if the house facing toward west as per vastu",n/a,0,n/a,0.00
2074,"what if the house is east facing house vastu",n/a,0,n/a,0.00
2075,"what if the master bed room is small vastu",n/a,0,n/a,0.00
2076,"what if tree is on property according to vastu",n/a,0,n/a,0.00
2077,"what if wall clock broke vastu",n/a,0,n/a,0.00
2078,"what if we have kitchen under stairs according vastu",n/a,0,n/a,0.00
2079,"what is 2 meaning in vastu shastra",n/a,0,n/a,0.00
2080,"what is 2 meaning in vastu shastra in hindi",n/a,0,n/a,0.00
2081,"what is a good vastu",n/a,0,n/a,0.00
2082,"what is a good vastu shop entrance as per",n/a,0,n/a,0.00
2083,"what is according to vastu shastra",n/a,0,n/a,0.00
2084,"what is aimula as per vastu",n/a,0,n/a,0.00
2085,"what is aura vastu",n/a,0,n/a,0.00
2086,"what is ayam in vastu",n/a,0,n/a,0.00
2087,"what is ayay for vastu",n/a,0,n/a,0.00
2088,"what is bad main main door as per vastu",n/a,0,n/a,0.00
2089,"what is bagua in vastu",n/a,0,n/a,0.00
2090,"what is benifit garlic live in room vastu",n/a,0,n/a,0.00
2091,"what is best cooking direction according vastu",n/a,0,n/a,0.00
2092,"what is best place for toilet as per vastu",n/a,0,n/a,0.00
2093,"what is best place for water sump as per vastu",n/a,0,n/a,0.00
2094,"what is bhojraj in vastu shastra",n/a,0,n/a,0.00
2095,"what is bhramasootm and yamasootram according to vastu",n/a,0,n/a,0.00
2096,"what is called agney in vastu shastra",n/a,0,n/a,0.00
2097,"what is called east facing house in vastu",n/a,0,n/a,0.00
2098,"what is center of vastu",n/a,0,n/a,0.00
2099,"what is colour vastu",n/a,0,n/a,0.00
2100,"what is commercial vastu",n/a,0,n/a,0.00
2101,"what is cp in vastu",n/a,0,n/a,0.00
2102,"what is cut as per vastu",n/a,0,n/a,0.00
2103,"what is cut or low in vastu",n/a,0,n/a,0.00
2104,"what is deflated north in vastu",n/a,0,n/a,0.00
2105,"what is door according to vastu",n/a,0,n/a,0.00
2106,"what is earth element in vastu",n/a,0,n/a,0.00
2107,"what is effects of south west entrance vastu",n/a,0,n/a,0.00
2108,"what is emerald good for as per vastu",n/a,0,n/a,0.00
2109,"what is energy vastu",n/a,0,n/a,0.00
2110,"what is fee for vastu consultation",n/a,0,n/a,0.00
2111,"what is fhen shui vastu",n/a,0,n/a,0.00
2112,"what is four corner in vastu",n/a,0,n/a,0.00
2113,"what is fourth pada of a wall.as per vastu",n/a,0,n/a,0.00
2114,"what is gajaaya in vastu",n/a,0,n/a,0.00
2115,"what is garnet crystal in vastu used for",n/a,0,n/a,0.00
2116,"what is geopathic vastu",n/a,0,n/a,0.00
2117,"what is good for job in vastu shastra",n/a,0,n/a,0.00
2118,"what is haya in vastu",n/a,0,n/a,0.00
2119,"what is kalyan vastu pooja for marriage",n/a,0,n/a,0.00
2120,"what is known as brahma sutra in vastu",n/a,0,n/a,0.00
2121,"what is known as yama suta in vastu",n/a,0,n/a,0.00
2122,"what is kuber mula in vastu shastra",n/a,0,n/a,0.00
2123,"what is lucky symbol according to vastu",n/a,0,n/a,0.00
2124,"what is master bedroom in vastu",n/a,0,n/a,0.00
2125,"what is matrangulam in vastu",n/a,0,n/a,0.00
2126,"what is meaning of seven horses painting according to vastu",n/a,0,n/a,0.00
2127,"what is meant by south east corner in vastu",n/a,0,n/a,0.00
2128,"what is most important part in home as per vastu",n/a,0,n/a,0.00
2129,"what is natural slope regarding vastu direction",n/a,0,n/a,0.00
2130,"what is on nadi vastu",n/a,0,n/a,0.00
2131,"what is parama sayika manadala in temple vastu",n/a,0,n/a,0.00
2132,"what is place of kitchen according to vastu",n/a,0,n/a,0.00
2133,"what is place of kitchen according to vastu in telugu",n/a,0,n/a,0.00
2134,"what is problem with south facing house as per vastu",n/a,0,n/a,0.00
2135,"what is problem with t facing house as per vastu",n/a,0,n/a,0.00
2136,"what is problem with tee facing house as per vastu",n/a,0,n/a,0.00
2137,"what is proportionate measurement in vastu",n/a,0,n/a,0.00
2138,"what is running horse direction as per vastu",n/a,0,n/a,0.00
2139,"what is s1 s2 in vastu",n/a,0,n/a,0.00
