#,Keyword,Intent,Volume,KD %,CPC (USD)
2140,"what is science behind vastu shastra",n/a,0,n/a,0.00
2141,"what is second best vastu direction for house entrance",n/a,0,n/a,0.00
2142,"what is second vastu",n/a,0,n/a,0.00
2143,"what is second vastu dosham",n/a,0,n/a,0.00
2144,"what is second vastu shastra",n/a,0,n/a,0.00
2145,"what is simha yoni in vastu shastra",n/a,0,n/a,0.00
2146,"what is slope direction regarding vastu",n/a,0,n/a,0.00
2147,"what is south west corner in house vastu",n/a,0,n/a,0.00
2148,"what is southwest corner called in vastu",n/a,0,n/a,0.00
2149,"what is street focus in vastu",n/a,0,n/a,0.00
2150,"what is talamanam in vastu",n/a,0,n/a,0.00
2151,"what is the 9 pada in vastu shastra",n/a,0,n/a,0.00
2152,"what is the best color for stairs according to vastu",n/a,0,n/a,0.00
2153,"what is the best day to purchase electronics by vastu",n/a,0,n/a,0.00
2154,"what is the best vastu",n/a,0,n/a,0.00
2155,"what is the definition of vastu agriculture",n/a,0,n/a,0.00
2156,"what is the dimension for a vastu pyramid",n/a,0,n/a,0.00
2157,"what is the direction of kitchen in vastu",n/a,0,n/a,0.00
2158,"what is the direction of toilet according vastu",n/a,0,n/a,0.00
2159,"what is the energy of jyoti according to vastu",n/a,0,n/a,0.00
2160,"what is the favorite offerings for bhujaga devta in vastu",n/a,0,n/a,0.00
2161,"what is the fire direction in vastu",n/a,0,n/a,0.00
2162,"what is the good vastu structure of west faces building",n/a,0,n/a,0.00
2163,"what is the house vastu of house in india",n/a,0,n/a,0.00
2164,"what is the importance of northeast in vastu",n/a,0,n/a,0.00
2165,"what is the importance of waterfall paintingaccording to vastu shashtra",n/a,0,n/a,0.00
2166,"what is the lucky number according to vastu for home",n/a,0,n/a,0.00
2167,"what is the meaning fish in vastu",n/a,0,n/a,0.00
2168,"what is the meaning for vastu",n/a,0,n/a,0.00
2169,"what is the meaning of facing in vastu",n/a,0,n/a,0.00
2170,"what is the meaning of shukrasta in vastu",n/a,0,n/a,0.00
2171,"what is the meaning of vastu shanti in english",n/a,0,n/a,0.00
2172,"what is the meaning of vastu shastra in english",n/a,0,n/a,0.00
2173,"what is the meaning of vastu shastra in hindi",n/a,0,n/a,0.00
2174,"what is the meaning of vishti in vastu animal",n/a,0,n/a,0.00
2175,"what is the measurement for vastu house",n/a,0,n/a,0.00
2176,"what is the measurement for vastu house pdf",n/a,0,n/a,0.00
2177,"what is the north direction.of a house as per vastu",n/a,0,n/a,0.00
2178,"what is the perfect colour for south as per vastu",n/a,0,n/a,0.00
2179,"what is the rate of 2bhk flate in vastu vihar",n/a,0,n/a,0.00
2180,"what is the sign of vastu snake in house garden",n/a,0,n/a,0.00
2181,"what is the significance of brahma brahmasthan in vastu",n/a,0,n/a,0.00
2182,"what is the size of mai get as per vastu",n/a,0,n/a,0.00
2183,"what is the solution of non vastu",n/a,0,n/a,0.00
2184,"what is the special of rog in vastu",n/a,0,n/a,0.00
2185,"what is the use of citrine tree in vastu",n/a,0,n/a,0.00
2186,"what is the vastu in hindi",n/a,0,n/a,0.00
2187,"what is the vastu padam in house in telugu",n/a,0,n/a,0.00
2188,"what is tortoise family in vastu",n/a,0,n/a,0.00
2189,"what is vastu dosh nivaran yantra",n/a,0,n/a,0.00
2190,"what is vastu in tamil",n/a,0,n/a,0.00
2191,"what is vastu mantra",n/a,0,n/a,0.00
2192,"what is vastu nall",n/a,0,n/a,0.00
2193,"what is vastu preferred door facing in house",n/a,0,n/a,0.00
2194,"what is vastu purush mahayantram",n/a,0,n/a,0.00
2195,"what is vastu quora",n/a,0,n/a,0.00
2196,"what is vastu remidies for girls delaying her marriege",n/a,0,n/a,0.00
2197,"what is vastu sadhguru",n/a,0,n/a,0.00
2198,"what is vastu says about your home design",n/a,0,n/a,0.00
2199,"what is vastu shanti pooja exactly",n/a,0,n/a,0.00
2200,"what is vastu shastra for house in hindi",n/a,0,n/a,0.00
2201,"what is vastu shastra in architecture",n/a,0,n/a,0.00
2202,"what is vastu shastra in hindi mytahelka",n/a,0,n/a,0.00
2203,"what is vastu shastra in malayalam",n/a,0,n/a,0.00
2204,"what is vastu shastra in marathi",n/a,0,n/a,0.00
2205,"what is vastu shastra in tamil",n/a,0,n/a,0.00
2206,"what is vastu shastra in telugu",n/a,0,n/a,0.00
2207,"what is vastu shastra or science of vastu",n/a,0,n/a,0.00
2208,"what is vastu shastra pdf",n/a,0,n/a,0.00
2209,"what is vastu significance of 7 horses painting at home",n/a,0,n/a,0.00
2210,"what is vastu solution on home",n/a,0,n/a,0.00
2211,"what is vastu solution on home inauguration",n/a,0,n/a,0.00
2212,"what is vastu zone for keeping plants",n/a,0,n/a,0.00
2213,"what is veedhipotu for plots as per vastu",n/a,0,n/a,0.00
2214,"what is wc in vastu",n/a,0,n/a,0.00
2215,"what is yama sutra vastu",n/a,0,n/a,0.00
2216,"what is zone gold horse in vastu shastra",n/a,0,n/a,0.00
2217,"what is zones gold horse in vastu shastra",n/a,0,n/a,0.00
2218,"what items should in bathroom in vastu",n/a,0,n/a,0.00
2219,"what kind of paintings hang in west direction in vastu",n/a,0,n/a,0.00
2220,"what kind of sofa to be used inliving room vastu",n/a,0,n/a,0.00
2221,"what makes money as per vastu",n/a,0,n/a,0.00
2222,"what makes prosperity as per vastu",n/a,0,n/a,0.00
2223,"what meant 112 east in vastu",n/a,0,n/a,0.00
2224,"what not to do in office as per vastu",n/a,0,n/a,0.00
2225,"what not to place on lockers as per vastu",n/a,0,n/a,0.00
2226,"what one can achieve from vastu",n/a,0,n/a,0.00
2227,"what painting to put in south wall vastu",n/a,0,n/a,0.00
2228,"what pictures can be placed at-home as per vastu",n/a,0,n/a,0.00
2229,"what pictures need to put as per vastu",n/a,0,n/a,0.00
2230,"what plants should be outside gate vastu",n/a,0,n/a,0.00
2231,"what plants trees should be outside gate vastu",n/a,0,n/a,0.00
2232,"what position the staircase in home as per vastu",n/a,0,n/a,0.00
2233,"what postion the sraircase in home as per vastu",n/a,0,n/a,0.00
2234,"what postion wc should be according to vastu",n/a,0,n/a,0.00
2235,"what rhings can fixed in foyer as per vastu",n/a,0,n/a,0.00
2236,"what room in north east corner if house vastu",n/a,0,n/a,0.00
2237,"what shape of dining table is best according to vastu",n/a,0,n/a,0.00
2238,"what shf be on west facing as per vastu",n/a,0,n/a,0.00
2239,"what shoud be bedroom vastu if 2 persons are earning",n/a,0,n/a,0.00
2240,"what should b the walpaper of pc according to vastu",n/a,0,n/a,0.00
2241,"what should be aquarium soil colour per vastu",n/a,0,n/a,0.00
2242,"what should be bed position according to vastu",n/a,0,n/a,0.00
2243,"what should be facing of house according to vastu shastra",n/a,0,n/a,0.00
2244,"what should be hall size in house as per vastu",n/a,0,n/a,0.00
2245,"what should be in wall poster as per vastu",n/a,0,n/a,0.00
2246,"what should be kept in north vastu",n/a,0,n/a,0.00
2247,"what should be kept on pc desktop wallpaper vastu",n/a,0,n/a,0.00
2248,"what should be position of bed according to vastu",n/a,0,n/a,0.00
2249,"what should be the apartment number according to vastu shastra",n/a,0,n/a,0.00
2250,"what should be the built up area as per vastu",n/a,0,n/a,0.00
2251,"what should be the color of kitchen according vastu",n/a,0,n/a,0.00
2252,"what should be the colour of door according to vastu",n/a,0,n/a,0.00
2253,"what should be the colout of furnitire according to vastu",n/a,0,n/a,0.00
2254,"what should be the placement of mandir as per vastu",n/a,0,n/a,0.00
2255,"what should be vastu for kids",n/a,0,n/a,0.00
2256,"what should be written on main door according to vastu",n/a,0,n/a,0.00
2257,"what should be written on main entrance according to vastu",n/a,0,n/a,0.00
2258,"what should br placed at the door for vastu",n/a,0,n/a,0.00
2259,"what should not be done in vastu shastra",n/a,0,n/a,0.00
2260,"what should not visible in mirror as per vastu",n/a,0,n/a,0.00
2261,"what should we put in the room according to vastu",n/a,0,n/a,0.00
2262,"what should.kept at entrance lobby according to.vastu",n/a,0,n/a,0.00
2263,"what side placed vastu horse images",n/a,0,n/a,0.00
2264,"what sign when purse fall in vastu zastra",n/a,0,n/a,0.00
2265,"what statue can we keep at home vastu",n/a,0,n/a,0.00
2266,"what statue to place in northwest vastu",n/a,0,n/a,0.00
2267,"what the cost of yamuna bungalow vastu vihar",n/a,0,n/a,0.00
2268,"what the fuck is vastu",n/a,0,n/a,0.00
2269,"what the vastu points",n/a,0,n/a,0.00
2270,"what things attract negative energy vastu shastra",n/a,0,n/a,0.00
2271,"what things to buy on dhanteras according to vastu",n/a,0,n/a,0.00
2272,"what time brick issued in sevalur vastu temple",n/a,0,n/a,0.00
2273,"what tipsare basic vastu",n/a,0,n/a,0.00
2274,"what to cook on friday related to vastu",n/a,0,n/a,0.00
2275,"what to do during solar eclipse as per vastu",n/a,0,n/a,0.00
2276,"what to do for career success in house vastu",n/a,0,n/a,0.00
2277,"what to do for rent a flat as per vastu",n/a,0,n/a,0.00
2278,"what to do if a vastu fish is swollen",n/a,0,n/a,0.00
2279,"what to do if bedroom in agni moola vastu",n/a,0,n/a,0.00
2280,"what to do if cat comes on the way vastu",n/a,0,n/a,0.00
2281,"what to do if kitchen direction is not according vastu",n/a,0,n/a,0.00
2282,"what to do if my shop is not vastu compliant",n/a,0,n/a,0.00
2283,"what to do if the master bedroom is vastu compliant",n/a,0,n/a,0.00
2284,"what to do on a vastu day",n/a,0,n/a,0.00
2285,"what to do on diwali day as per vastu",n/a,0,n/a,0.00
2286,"what to do on wednesday according to vastu",n/a,0,n/a,0.00
2287,"what to do with the spatik given by sarala vastu",n/a,0,n/a,0.00
2288,"what to do with the sphatik given by sarala vastu",n/a,0,n/a,0.00
2289,"what to do with tulsi tree as per vastu",n/a,0,n/a,0.00
2290,"what to do with tulsi tree at home by vastu",n/a,0,n/a,0.00
2291,"what to do with yellow kauri for vastu",n/a,0,n/a,0.00
2292,"what to do wth old photo of god in vastu",n/a,0,n/a,0.00
2293,"what to have in southwest vastu",n/a,0,n/a,0.00
2294,"what to see while buying an appartment as per vastu",n/a,0,n/a,0.00
2295,"what to wear to get success according to vastu shashtra",n/a,0,n/a,0.00
2296,"what to write on nameplate vastu",n/a,0,n/a,0.00
2297,"what type of clock should hang according to vastu",n/a,0,n/a,0.00
2298,"what type trunk elephant should be there as vastu",n/a,0,n/a,0.00
2299,"what vastu causes health issues for women",n/a,0,n/a,0.00
2300,"what vastu causes health issues for women telugu",n/a,0,n/a,0.00
2301,"what vastu causes marriage to not happen",n/a,0,n/a,0.00
2302,"what vastu compliant",n/a,0,n/a,0.00
2303,"what vastu issues occur if u face west in office",n/a,0,n/a,0.00
2304,"what vastu say about banana tree at home",n/a,0,n/a,0.00
2305,"what vastu thing to keep in office to generate moey",n/a,0,n/a,0.00
2306,"what vastu tips should be followed for health",n/a,0,n/a,0.00
2307,"what wall painting should be used according to vastu",n/a,0,n/a,0.00
2308,"what we call vastu in englisj",n/a,0,n/a,0.00
2309,"what we call vastu sastra in islam",n/a,0,n/a,0.00
2310,"what we can do to finish vastu dosh",n/a,0,n/a,0.00
2311,"what we should do for vastu interiors",n/a,0,n/a,0.00
2312,"what would be the toilet position according to vastu",n/a,0,n/a,0.00
2313,"what's money plants vastu kannada",n/a,0,n/a,0.00
2314,"what's side slip for vastu shastra",n/a,0,n/a,0.00
2315,"when do we attend to vastu pelli for house",n/a,0,n/a,0.00
2316,"when fire elements come on air element in vastu shastra",n/a,0,n/a,0.00
2317,"when north east high vastu remedies",n/a,0,n/a,0.00
2318,"when not to wash floors with salt vastu",n/a,0,n/a,0.00
2319,"when pigeon enters house as per vastu",n/a,0,n/a,0.00
2320,"when to apply oil according to vastu",n/a,0,n/a,0.00
2321,"when to go in floor mill as per vastu",n/a,0,n/a,0.00
2322,"when to not shift home vastu months",n/a,0,n/a,0.00
2323,"when to place vastu maha yantra at home",n/a,0,n/a,0.00
2324,"when to purchase furniture accirding to vastu",n/a,0,n/a,0.00
2325,"when to remove brahma kamal plant and vastu",n/a,0,n/a,0.00
2326,"when to sale iron as per vastu",n/a,0,n/a,0.00
2327,"when we demolish a old house as per vastu shastra",n/a,0,n/a,0.00
2328,"when we should we bring bamboo vastu plan",n/a,0,n/a,0.00
2329,"when your house is not according to vastu",n/a,0,n/a,0.00
2330,"where a laughing buddha should be kept by vastu shastra",n/a,0,n/a,0.00
2331,"where a laughing buddha should be kept by vastu shastre",n/a,0,n/a,0.00
2332,"where add carshed for east facing home vastu telugu",n/a,0,n/a,0.00
2333,"where ahould the dining room be according to vastu",n/a,0,n/a,0.00
2334,"where are the saral vastu",n/a,0,n/a,0.00
2335,"where are the saral vastu address",n/a,0,n/a,0.00
2336,"where can i have pit as per vastu",n/a,0,n/a,0.00
2337,"where can the main door be located according to vastu",n/a,0,n/a,0.00
2338,"where do u keep aquarium as per vastu",n/a,0,n/a,0.00
2339,"where do we get vastu mirrors",n/a,0,n/a,0.00
2340,"where do you place gym equipment as per vastu",n/a,0,n/a,0.00
2341,"where drill bore in home as per vastu",n/a,0,n/a,0.00
2342,"where dwarkadheesh vastu book is available",n/a,0,n/a,0.00
2343,"where eagle idol can be placed at home vastu",n/a,0,n/a,0.00
2344,"where fountain to be kept in home vastu",n/a,0,n/a,0.00
2345,"where i hang family pic according to vastu",n/a,0,n/a,0.00
2346,"where is bhramasthana in vastu shastra",n/a,0,n/a,0.00
2347,"where is kennel placed in house boundary according to vastu",n/a,0,n/a,0.00
2348,"where is location of gas in kichen as per vastu",n/a,0,n/a,0.00
2349,"where is mathiapur vastu vihar project in patna map",n/a,0,n/a,0.00
2350,"where is mirror put in house as per vastu",n/a,0,n/a,0.00
2351,"where is parking appropriate as per vastu",n/a,0,n/a,0.00
2352,"where is pooja room vastu fo rhome",n/a,0,n/a,0.00
2353,"where is red light used in homes as per vastu",n/a,0,n/a,0.00
2354,"where is the metal element according to vastu",n/a,0,n/a,0.00
2355,"where is the place to keep water tank in vastu",n/a,0,n/a,0.00
2356,"where is the seating in offce by vastu shastra",n/a,0,n/a,0.00
2357,"where is waterfall in home auspicious acc to vastu",n/a,0,n/a,0.00
2358,"where is windows in home as per vastu",n/a,0,n/a,0.00
2359,"where kitchen should be located as per vastu",n/a,0,n/a,0.00
2360,"where mirror can be placed as per vastu",n/a,0,n/a,0.00
2361,"where place bed on vastu",n/a,0,n/a,0.00
2362,"where place god on vastu",n/a,0,n/a,0.00
2363,"where power should sleep in home as per vastu",n/a,0,n/a,0.00
2364,"where put light in vastu",n/a,0,n/a,0.00
2365,"where put watch in vastu",n/a,0,n/a,0.00
2366,"where rasoi ghar bartan set vastu",n/a,0,n/a,0.00
2367,"where rasoi ghar set vastu",n/a,0,n/a,0.00
2368,"where should a mirror be placed for good vastu",n/a,0,n/a,0.00
2369,"where should aloe vera be kept in house vastu",n/a,0,n/a,0.00
2370,"where should bathroom be as per vastu in kitchen",n/a,0,n/a,0.00
2371,"where should be basin according to vastu sastra",n/a,0,n/a,0.00
2372,"where should be counter as ber vastu",n/a,0,n/a,0.00
2373,"where should be heavy objects in bedroom as per vastu",n/a,0,n/a,0.00
2374,"where should be kitchten as per vastu",n/a,0,n/a,0.00
2375,"where should be lord buddha kept according to vastu",n/a,0,n/a,0.00
2376,"where should be place the tree according to vastu",n/a,0,n/a,0.00
2377,"where should be septic tank as per vastu in punjab",n/a,0,n/a,0.00
2378,"where should be the cooking range according to vastu",n/a,0,n/a,0.00
2379,"where should be the master bedroom according to vastu",n/a,0,n/a,0.00
2380,"where should be the syntax put as per vastu",n/a,0,n/a,0.00
2381,"where should be the toilet according to indian vastu",n/a,0,n/a,0.00
2382,"where should be tree install according to vastu",n/a,0,n/a,0.00
2383,"where should be window placed according to vastu",n/a,0,n/a,0.00
2384,"where should be window placed in bedroom according to vastu",n/a,0,n/a,0.00
2385,"where should be window placed in bedrooms according to vastu",n/a,0,n/a,0.00
2386,"where should boring well be according to vastu shanti",n/a,0,n/a,0.00
2387,"where should bothroom be as per vastu in kitchen",n/a,0,n/a,0.00
2388,"where should dhanavantri statue be located acc to vastu",n/a,0,n/a,0.00
2389,"where should doctors sit on chamber as per vastu",n/a,0,n/a,0.00
2390,"where should fridge go in kitchen vastu",n/a,0,n/a,0.00
2391,"where should i keep my computer according to vastu",n/a,0,n/a,0.00
2392,"where should i place vastu kachua",n/a,0,n/a,0.00
2393,"where should i place vastu purusha in house",n/a,0,n/a,0.00
2394,"where should i put my keys according to vastu",n/a,0,n/a,0.00
2395,"where should keep tv as per vastu",n/a,0,n/a,0.00
2396,"where should kubera face in shop as per vastu",n/a,0,n/a,0.00
2397,"where should mirror be placed as per vastu in bedroom",n/a,0,n/a,0.00
2398,"where should one grow cactus according to vastu",n/a,0,n/a,0.00
2399,"where should one keep plants according to vastu",n/a,0,n/a,0.00
2400,"where should picture of ship placed as per vastu",n/a,0,n/a,0.00
2401,"where should place vastu pyramid",n/a,0,n/a,0.00
2402,"where should pooja room come in an apartment vastu",n/a,0,n/a,0.00
2403,"where should study room be according to vastu",n/a,0,n/a,0.00
2404,"where should study table be according to vastu",n/a,0,n/a,0.00
2405,"where should the altar be placed as per vastu",n/a,0,n/a,0.00
2406,"where should the boss seat as per vastu in office",n/a,0,n/a,0.00
2407,"where should the master bedroom be as per vastu",n/a,0,n/a,0.00
2408,"where should the medicine kept according to vastu",n/a,0,n/a,0.00
2409,"where should water outlet go according to vastu",n/a,0,n/a,0.00
2410,"where should water tap at outside keep as per vastu",n/a,0,n/a,0.00
2411,"where should water tap keep as per vastu",n/a,0,n/a,0.00
2412,"where should waterfall wallpaper plug in home as per vastu",n/a,0,n/a,0.00
2413,"where should we keep 7 horses as per vastu",n/a,0,n/a,0.00
2414,"where should we keep clock according to vastu",n/a,0,n/a,0.00
2415,"where should we keep vastu nivarana yantra",n/a,0,n/a,0.00
2416,"where should we looking in temple in vastu shastra",n/a,0,n/a,0.00
2417,"where should we place mirror in office as per vastu",n/a,0,n/a,0.00
2418,"where should we plant ashoka tree according to vastu",n/a,0,n/a,0.00
2419,"where should we put muncipal water tap as per vastu",n/a,0,n/a,0.00
2420,"where should we put water tap as per vastu",n/a,0,n/a,0.00
2421,"where should you not place the puja in vastu",n/a,0,n/a,0.00
2422,"where should you store your shoes by vastu",n/a,0,n/a,0.00
2423,"where shouldriver be near a plot as per vastu",n/a,0,n/a,0.00
2424,"where t o plant drumstick plant as per vastu",n/a,0,n/a,0.00
2425,"where the clock should be facing acc to vastu",n/a,0,n/a,0.00
2426,"where the main entrance of house according to vastu",n/a,0,n/a,0.00
2427,"where the toilet in vastu if north facing house",n/a,0,n/a,0.00
2428,"where tk pout dustbin vastu",n/a,0,n/a,0.00
2429,"where to arrange the dressing table vastu",n/a,0,n/a,0.00
2430,"where to avoid temple according to vastu",n/a,0,n/a,0.00
2431,"where to be store house as per vastu",n/a,0,n/a,0.00
2432,"where to build overhead water tank vastu",n/a,0,n/a,0.00
2433,"where to buy vastu products in old delhi",n/a,0,n/a,0.00
2434,"where to cook as per vastu",n/a,0,n/a,0.00
2435,"where to dig borewell as per vastu",n/a,0,n/a,0.00
2436,"where to dig borewell as per vastu in telugu",n/a,0,n/a,0.00
2437,"where to dig septic tank telugu vastu",n/a,0,n/a,0.00
2438,"where to dinning table according to vastu",n/a,0,n/a,0.00
2439,"where to do boring as per vastu",n/a,0,n/a,0.00
2440,"where to do stone erection as per vastu",n/a,0,n/a,0.00
2441,"where to drain water fromm plot according to vastu",n/a,0,n/a,0.00
2442,"where to dug latrine well as vastu shastra",n/a,0,n/a,0.00
2443,"where to fix main door in vastu",n/a,0,n/a,0.00
2444,"where to fix main door in vastu in tamil",n/a,0,n/a,0.00
2445,"where to get vastu pyramid in chennai",n/a,0,n/a,0.00
2446,"where to grow bael plant as per vastu",n/a,0,n/a,0.00
2447,"where to hang artificial plant vastu",n/a,0,n/a,0.00
2448,"where to hang elders photos as per vastu",n/a,0,n/a,0.00
2449,"where to hang krishan ji with cow picture vastu",n/a,0,n/a,0.00
2450,"where to hang mirror according to vastu",n/a,0,n/a,0.00
2451,"where to hang om symbol as per vastu",n/a,0,n/a,0.00
2452,"where to hang sunrise and mountains as per vastu",n/a,0,n/a,0.00
2453,"where to hang tree of life in vastu shastra",n/a,0,n/a,0.00
2454,"where to have a fountain in vastu",n/a,0,n/a,0.00
2455,"where to have bedrooms as per vastu",n/a,0,n/a,0.00
2456,"where to keep a pond vastu",n/a,0,n/a,0.00
2457,"where to keep aquarium in home according to vastu",n/a,0,n/a,0.00
2458,"where to keep bamboo plant according to vastu in home",n/a,0,n/a,0.00
2459,"where to keep boiler in house bathroom vastu",n/a,0,n/a,0.00
2460,"where to keep buddha picture in home as per vastu",n/a,0,n/a,0.00
2461,"where to keep crystal tortoise at home according to vastu",n/a,0,n/a,0.00
2462,"where to keep documents as per vastu",n/a,0,n/a,0.00
2463,"where to keep dog cage as per vastu",n/a,0,n/a,0.00
2464,"where to keep dragon at home vastu",n/a,0,n/a,0.00
2465,"where to keep drinking water in house as per vastu",n/a,0,n/a,0.00
2466,"where to keep educatin tower at home vastu",n/a,0,n/a,0.00
2467,"where to keep emon in water glass vastu in tamil",n/a,0,n/a,0.00
2468,"where to keep emon in water glass vastu shastra",n/a,0,n/a,0.00
2469,"where to keep files bureau in office vastu",n/a,0,n/a,0.00
2470,"where to keep fish aquarium at home by vastu",n/a,0,n/a,0.00
2471,"where to keep fridge according to vastu and fengshui",n/a,0,n/a,0.00
2472,"where to keep gas cylinder in kitchen according to vastu",n/a,0,n/a,0.00
2473,"where to keep god image in office as per vastu",n/a,0,n/a,0.00
2474,"where to keep god maps in house vastu",n/a,0,n/a,0.00
2475,"where to keep gods in office as per vastu",n/a,0,n/a,0.00
2476,"where to keep health reports as per vastu",n/a,0,n/a,0.00
2477,"where to keep heavy things in vastu",n/a,0,n/a,0.00
2478,"where to keep lemon in water glass vastu shastra",n/a,0,n/a,0.00
2479,"where to keep lift according vastu",n/a,0,n/a,0.00
2480,"where to keep lilli plant in house vastu",n/a,0,n/a,0.00
2481,"where to keep lillirose plant in house vastu",n/a,0,n/a,0.00
2482,"where to keep lily rose plant in house vastu",n/a,0,n/a,0.00
2483,"where to keep lucky bamboo according to vastu",n/a,0,n/a,0.00
2484,"where to keep main electricity board as per vastu",n/a,0,n/a,0.00
2485,"where to keep medical documents as per vastu",n/a,0,n/a,0.00
2486,"where to keep metal tortoise in shop according to vastu",n/a,0,n/a,0.00
2487,"where to keep money plant vastu",n/a,0,n/a,0.00
2488,"where to keep my daughter photo according to vastu",n/a,0,n/a,0.00
2489,"where to keep needle scissors as per vastu",n/a,0,n/a,0.00
2490,"where to keep needle sewing as per vastu",n/a,0,n/a,0.00
2491,"where to keep our broom as per vastu",n/a,0,n/a,0.00
2492,"where to keep outdoor fish tank as per vastu",n/a,0,n/a,0.00
2493,"where to keep own photos vastu",n/a,0,n/a,0.00
2494,"where to keep panchmukhi ganesh according to vastu",n/a,0,n/a,0.00
2495,"where to keep pooja room as per vastu in house",n/a,0,n/a,0.00
2496,"where to keep pyramid in home vastu dush",n/a,0,n/a,0.00
2497,"where to keep reports as per vastu",n/a,0,n/a,0.00
2498,"where to keep rock salt in house according to vastu",n/a,0,n/a,0.00
2499,"where to keep rose plant in house vastu",n/a,0,n/a,0.00
2500,"where to keep sampoorna vastu dosh nivaran yantra",n/a,0,n/a,0.00
2501,"where to keep shoes rack as per vastu",n/a,0,n/a,0.00
2502,"where to keep showpiece as per vastu",n/a,0,n/a,0.00
2503,"where to keep snnjjii plant in house vastu",n/a,0,n/a,0.00
2504,"where to keep steel almirah as per vastu",n/a,0,n/a,0.00
2505,"where to keep sump vastu",n/a,0,n/a,0.00
2506,"where to keep tablets vastu",n/a,0,n/a,0.00
2507,"where to keep the selling stock as per vastu",n/a,0,n/a,0.00
2508,"where to keep the unsold stock as per vastu",n/a,0,n/a,0.00
2509,"where to keep tulsi plant in vastu",n/a,0,n/a,0.00
2510,"where to keep tv according to vastu",n/a,0,n/a,0.00
2511,"where to keep vastu elephant statue direction in tamil",n/a,0,n/a,0.00
2512,"where to keep vastu idol",n/a,0,n/a,0.00
2513,"where to keep vastu kalash",n/a,0,n/a,0.00
2514,"where to keep vastu plant",n/a,0,n/a,0.00
2515,"where to keep vastu tree having panchmukhi stones",n/a,0,n/a,0.00
2516,"where to keep vastu yantra",n/a,0,n/a,0.00
2517,"where to keep vastu yantra in house",n/a,0,n/a,0.00
2518,"where to keep washing machine acrding to vastu",n/a,0,n/a,0.00
2519,"where to keep washing machine direction according to vastu",n/a,0,n/a,0.00
2520,"where to keepgod maps in house vastu",n/a,0,n/a,0.00
2521,"where to keeplillirose plant in house vastu",n/a,0,n/a,0.00
2522,"where to kepp money plant in house as per vastu",n/a,0,n/a,0.00
2523,"where to kepp rubber plant in house as per vastu",n/a,0,n/a,0.00
2524,"where to lacate wind chimes according to vastu shashtra",n/a,0,n/a,0.00
2525,"where to locate the locker in master bedroom vastu",n/a,0,n/a,0.00
2526,"where to paste 7 horses vastu posters",n/a,0,n/a,0.00
2527,"where to place ac in bedroom as per vastu",n/a,0,n/a,0.00
2528,"where to place accounts in our office as per vastu",n/a,0,n/a,0.00
2529,"where to place aloe vera plant in home vastu malayalam",n/a,0,n/a,0.00
2530,"where to place amrit kslash in house vastu",n/a,0,n/a,0.00
2531,"where to place aquarium in living room as per vastu",n/a,0,n/a,0.00
2532,"where to place ashoka pillar as per vastu",n/a,0,n/a,0.00
2533,"where to place banana tree as per vastu",n/a,0,n/a,0.00
2534,"where to place bathroom as per vastu",n/a,0,n/a,0.00
2535,"where to place book case as per vastu",n/a,0,n/a,0.00
2536,"where to place bookshelf in living room vastu",n/a,0,n/a,0.00
2537,"where to place cactus in home according to vastu",n/a,0,n/a,0.00
2538,"where to place cash box vastu direction",n/a,0,n/a,0.00
2539,"where to place computer according to vastu",n/a,0,n/a,0.00
2540,"where to place cooking oil in kitchen as per vastu",n/a,0,n/a,0.00
