#,Keyword,Intent,Volume,KD %,CPC (USD)
1,"what is vastu",I,1600,37,0.17
2,"is vastu real",I,880,22,0.00
3,"is vastu shastra real",I,880,23,0.00
4,"is vastu true",I,880,23,0.00
5,"which direction to sleep as per vastu",I,720,21,0.01
6,"how to check vastu for home entrance",I,590,19,0.04
7,"what is vastu shastra",I,590,22,0.07
8,"where should be kitchen as per vastu",I,590,23,0.01
9,"how to check vastu of house",I,480,10,0.06
10,"is south facing house good according to vastu",I,480,n/a,0.02
11,"is south facing house good as per vastu",I,480,19,0.00
12,"how to check vastu for flat",I,390,17,0.06
13,"which colour is best for kitchen slab according to vastu",I,390,19,0.00
14,"which is best facing house as per vastu",I,390,21,0.03
15,"is west facing house good as per vastu",I,320,17,0.02
16,"where is to keep vastu pyramid in house",I,320,21,0.00
17,"where to keep medicines as per vastu",I,320,24,0.00
18,"which painting is good for bedroom according to vastu",I,320,8,0.05
19,"which side should we sleep according to vastu",I,320,18,0.00
20,"does vastu really work",I,260,15,0.00
21,"how many fish to keep in aquarium as per vastu",I,260,26,0.00
22,"where to keep shoe rack as per vastu",I,260,30,0.01
23,"where to keep tortoise at home according to vastu",I,260,17,0.00
24,"which floor is best according to vastu",C,260,15,0.00
25,"which is the best direction to sleep as per vastu",C,260,22,0.11
26,"which shape of clock according to vastu",I,260,11,0.00
27,"how many doors as per vastu",I,210,11,0.00
28,"how to calculate brahmasthan in vastu",I,210,13,0.00
29,"how to find vastu dosh in house",I,210,21,0.05
30,"where to keep money at home as per vastu",I,210,23,0.00
31,"which colour is best for bedroom according to vastu",I,210,15,0.00
32,"which facing plot is good as per vastu",I,210,11,0.00
33,"which side to sleep vastu",I,210,22,0.00
34,"does vastu really matter",I,170,13,0.00
35,"how to balance five elements in vastu",I,170,0,0.00
36,"how to install vastu copper strip",I,170,13,0.00
37,"how to learn vastu shastra",I,170,18,0.13
38,"how to sleep according to vastu",I,170,21,0.00
39,"how to sleep as per vastu",I,170,21,0.00
40,"is vastu scientific",I,170,19,0.00
41,"where to keep dustbin as per vastu",I,170,5,0.00
42,"where to keep jade plant as per vastu",I,170,5,0.00
43,"where to place fish tank in home as per vastu",I,170,25,0.00
44,"which colour is best for kitchen according to vastu",I,170,11,0.00
45,"which direction should we sleep as per vastu",I,170,23,0.00
46,"how to check vastu of flat online",I,140,8,0.07
47,"how to keep broom according to vastu",I,140,17,0.00
48,"how to keep broom as per vastu",I,140,17,0.00
49,"is north facing house good as per vastu",I,140,22,0.00
50,"is pigeon good for home vastu",I,140,23,0.00
51,"where should be toilet as per vastu",I,140,15,0.00
52,"where to keep lemon in water as per vastu",I,140,23,0.00
53,"where to keep rubber plant as per vastu",n/a,140,n/a,0.00
54,"where to keep shoes as per vastu",I,140,16,0.00
55,"where to place mirror as per vastu",I,140,12,0.01
56,"where to place vastu yantra at home",I,140,11,0.00
57,"where to place wall clock as per vastu",I,140,11,0.01
58,"where to sleep as per vastu",n/a,140,n/a,0.00
59,"which colour is good for bedroom as per vastu",I,140,11,0.00
60,"which direction is best for kitchen as per vastu",I,140,16,0.00
61,"which direction to sleep according to vastu",I,140,24,0.00
62,"which floor is best as per vastu",C,140,9,0.00
63,"which plant is good for home according to vastu",n/a,140,n/a,0.00
64,"which plants are good for home according to vastu",I,140,14,0.01
65,"which side to sleep as per vastu",I,140,26,0.00
66,"which tulsi is best for home as per vastu",n/a,140,n/a,0.00
67,"how to check direction of house vastu",I,110,16,0.02
68,"how to count number of doors as per vastu",I,110,12,0.00
69,"how to find center of house vastu",I,110,27,0.05
70,"how to remove vastu dosh from home",I,110,18,0.04
71,"how to use compass for vastu",I,110,16,0.00
72,"is east facing house good as per vastu",I,110,10,0.00
73,"is vastu applicable for flats",I,110,13,0.00
74,"where to hang dead person photo as per vastu",n/a,110,n/a,0.00
75,"where to keep aloe vera plant in house vastu",n/a,110,n/a,0.00
76,"where to keep locker as per vastu",n/a,110,n/a,0.00
77,"where to keep mirror as per vastu",n/a,110,n/a,0.00
78,"where to keep money as per vastu",n/a,110,n/a,0.00
79,"where to keep tulsi plant at home according to vastu",n/a,110,n/a,0.00
80,"where to keep washing machine as per vastu",n/a,110,n/a,0.00
81,"where to place shoe rack as per vastu",I,110,23,0.01
82,"which direction is best to sleep as per vastu",n/a,110,n/a,0.00
83,"which side should we sleep as per vastu",n/a,110,n/a,0.00
84,"which side to sleep according to vastu",n/a,110,n/a,0.00
85,"which side we should sleep as per vastu",n/a,110,n/a,0.00
86,"where should be bathroom as per vastu",n/a,90,n/a,0.00
87,"where should be pooja room as per vastu",n/a,90,n/a,0.01
88,"where should toilet be as per vastu",n/a,90,n/a,0.00
89,"where should wife sleep according to vastu",n/a,90,n/a,0.00
90,"where to keep almirah as per vastu",n/a,90,n/a,0.00
91,"where to keep bamboo plant in house as per vastu",n/a,90,n/a,0.00
92,"where to keep locker in house as per vastu",n/a,90,n/a,0.00
93,"where to put family photos in home vastu",n/a,90,n/a,0.00
94,"which side bathroom in vastu",n/a,90,n/a,0.00
95,"how to check entrance of house as per vastu",n/a,70,n/a,0.00
96,"how to check vastu",n/a,70,n/a,0.00
97,"how to check vastu directions",n/a,70,n/a,0.02
98,"where to keep clock as per vastu",n/a,70,n/a,0.00
99,"where to keep money plant as per vastu",n/a,70,n/a,0.00
100,"where to keep peacock feather as per vastu",n/a,70,n/a,0.00
101,"which direction we should sleep as per vastu",n/a,70,n/a,0.00
102,"which fish to keep in aquarium as per vastu",n/a,70,n/a,0.00
103,"which side should wife sleep as per vastu",n/a,70,n/a,0.00
104,"who wrote vastu shastra",n/a,70,n/a,0.00
105,"is vastu shastra true",n/a,50,n/a,0.00
106,"what is vastu dosh",n/a,50,n/a,0.00
107,"where to keep fish tank as per vastu",n/a,50,n/a,0.00
108,"where to keep fish tank in house as per vastu",n/a,50,n/a,0.00
109,"where to sleep according to vastu",n/a,50,n/a,0.00
110,"which colour is best for living room according to vastu",n/a,50,n/a,0.00
111,"which direction should we sleep according to vastu",n/a,50,n/a,0.00
112,"how to attract wealth vastu",n/a,40,n/a,0.00
113,"how to calculate room size as per vastu",n/a,40,n/a,0.00
114,"how to find vastu directions for home",n/a,40,n/a,0.01
115,"what is agnikone in vastu",n/a,40,n/a,0.00
116,"what is ishan kon in vastu",n/a,40,n/a,0.00
117,"where to place almirah as per vastu",n/a,40,n/a,0.00
118,"where to place calendar in home as per vastu",n/a,40,n/a,0.00
119,"which color is best for master bedroom as per vastu",n/a,40,n/a,0.01
120,"which side not to sleep as per vastu",n/a,40,n/a,0.00
121,"do foreigners follow vastu",n/a,30,n/a,0.00
122,"does vastu matter for rented house",n/a,30,n/a,0.00
123,"does vastu work in flats",n/a,30,n/a,0.00
124,"how many burners as per vastu",n/a,30,n/a,0.00
125,"how many doors and windows as per vastu",n/a,30,n/a,0.00
126,"how many doors and windows as per vastu in telugu",n/a,30,n/a,0.00
127,"how many doors in house as per vastu",n/a,30,n/a,0.00
128,"how many steps as per vastu",n/a,30,n/a,0.00
129,"how many steps entrance of a house vastu",n/a,30,n/a,0.00
130,"how should be the vastu of the house",n/a,30,n/a,0.02
131,"how to be a vastu consultant",n/a,30,n/a,0.00
132,"how to become vastu consultant",n/a,30,n/a,0.11
133,"how to check direction of house as per vastu",n/a,30,n/a,0.04
134,"how to check my house vastu",n/a,30,n/a,0.05
135,"how to check vastu directions for home",n/a,30,n/a,0.04
136,"how to correct vastu defects",n/a,30,n/a,0.00
137,"how to correct vastu dosh",n/a,30,n/a,0.02
138,"how to cover beams on ceiling as per vastu",n/a,30,n/a,0.00
139,"how to design home as per vastu shastra",n/a,30,n/a,0.03
140,"how to find house facing direction vastu",n/a,30,n/a,0.00
141,"how to find out brahmasthan in vastu",n/a,30,n/a,0.00
142,"how to know vastu dosh",n/a,30,n/a,0.00
143,"how to learn vastu shastra in tamil",n/a,30,n/a,0.00
144,"how to make siddha vastu kalash",n/a,30,n/a,0.00
145,"how to make vastu shanti invitation card",n/a,30,n/a,0.00
146,"how to measure pada in vastu",n/a,30,n/a,0.00
147,"how to place vastu pyramid",n/a,30,n/a,0.00
148,"how to rectify vastu defects",n/a,30,n/a,0.00
149,"how to rectify vastu dosh",n/a,30,n/a,0.01
150,"how to remove vastu dosh",n/a,30,n/a,0.02
151,"how to remove vastu dosh from house",n/a,30,n/a,0.03
152,"how to remove vastu dosh of south facing house",n/a,30,n/a,0.00
153,"how to see vastu for flats",n/a,30,n/a,0.00
154,"how to sweep the house as per vastu",n/a,30,n/a,0.00
155,"how to use compass for house vastu",n/a,30,n/a,0.00
156,"how to use vastu shakti chakra",n/a,30,n/a,0.00
157,"is aloe vera plant good for home as per vastu",n/a,30,n/a,0.00
158,"is cactus good for home as per vastu",n/a,30,n/a,0.00
159,"is it necessary to follow vastu",n/a,30,n/a,0.00
160,"is south east facing house good as per vastu",n/a,30,n/a,0.00
161,"is turtle good for vastu",n/a,30,n/a,0.00
162,"is vastu applicable in usa",n/a,30,n/a,0.00
163,"is vastu important for flats",n/a,30,n/a,0.00
164,"is vastu really effective",n/a,30,n/a,0.00
165,"is vastu shastra a science",n/a,30,n/a,0.00
166,"is vastu shastra believable",n/a,30,n/a,0.00
167,"what does vastu compliant mean",n/a,30,n/a,0.00
168,"what is astro vastu",n/a,30,n/a,0.00
169,"what is pyramid vastu",n/a,30,n/a,0.00
170,"what is the best direction to sleep as per vastu",n/a,30,n/a,0.01
171,"what is the meaning of vastu",n/a,30,n/a,0.00
172,"what is the right direction to sleep as per vastu",n/a,30,n/a,0.00
173,"what is vastu pyramid",n/a,30,n/a,0.03
174,"what is vastu shastra called in english",n/a,30,n/a,0.00
175,"what is vastu shastra in english",n/a,30,n/a,0.00
176,"what is vastu vinimay in hindi",n/a,30,n/a,0.00
177,"where to face in office as per vastu",n/a,30,n/a,0.00
178,"where to hang calendar as per vastu",n/a,30,n/a,0.00
179,"where to hang clock as per vastu",n/a,30,n/a,0.01
180,"where to keep dressing table as per vastu",n/a,30,n/a,0.00
181,"where to keep medicine in the house as per vastu",n/a,30,n/a,0.00
182,"where to keep medicines at home as per vastu",n/a,30,n/a,0.00
183,"where to keep mirror in house as per vastu",n/a,30,n/a,0.00
184,"where to keep money according to vastu",n/a,30,n/a,0.00
185,"where to keep photos of dead as per vastu",n/a,30,n/a,0.00
186,"where to keep stove as per vastu",n/a,30,n/a,0.00
187,"where to keep tortoise at office according to vastu",n/a,30,n/a,0.00
188,"where to keep used clothes as per vastu",n/a,30,n/a,0.00
189,"where to keep vastu plant in home",n/a,30,n/a,0.00
190,"where to keep water fountain in house as per vastu",n/a,30,n/a,0.01
191,"where to place cupboard as per vastu",n/a,30,n/a,0.00
192,"where to place dressing table in bedroom as per vastu",n/a,30,n/a,0.00
193,"where to place money plant according to vastu",n/a,30,n/a,0.00
194,"where to place money plant at home as per vastu",n/a,30,n/a,0.00
195,"where to place vastu yantra",n/a,30,n/a,0.00
196,"where to plant bamboo tree as per vastu",n/a,30,n/a,0.00
197,"where to plant pomegranate tree as per vastu",n/a,30,n/a,0.00
198,"where to plant tulsi plant as per vastu",n/a,30,n/a,0.00
199,"which color is best for kitchen according to vastu",n/a,30,n/a,0.00
200,"which color is best for kitchen as per vastu",n/a,30,n/a,0.00
201,"which color is good for bedroom as per vastu",n/a,30,n/a,0.01
202,"which direction is good for house according to vastu",n/a,30,n/a,0.00
203,"which direction is good to sleep as per vastu",n/a,30,n/a,0.00
204,"which direction should i sleep vastu",n/a,30,n/a,0.00
205,"which direction sleep vastu",n/a,30,n/a,0.00
206,"which direction to cook as per vastu",n/a,30,n/a,0.00
207,"which direction to face while studying according to vastu",n/a,30,n/a,0.00
208,"which direction to sleep in vastu",n/a,30,n/a,0.00
209,"which direction to study as per vastu",n/a,30,n/a,0.00
210,"which entrance is good as per vastu",n/a,30,n/a,0.01
211,"which painting is good for living room as per vastu",n/a,30,n/a,0.01
212,"which plant is good for vastu",n/a,30,n/a,0.00
213,"which position is best for sleeping as per vastu",n/a,30,n/a,0.00
214,"which side is best to sleep according to vastu",n/a,30,n/a,0.00
215,"which side should kitchen face as per vastu",n/a,30,n/a,0.00
216,"which side should wife sleep according to vastu",n/a,30,n/a,0.00
217,"which tree is best for home according to vastu",n/a,30,n/a,0.00
218,"who is vastu",n/a,30,n/a,0.00
219,"why is vastu important",n/a,30,n/a,0.00
220,"can vastu dosh cause death",n/a,20,n/a,0.00
221,"can vastu dosh cause health problems",n/a,20,n/a,0.00
222,"can we keep succulents at home according to vastu",n/a,20,n/a,0.00
223,"can we sit under beam according to vastu",n/a,20,n/a,0.00
224,"does vastu affect health",n/a,20,n/a,0.00
225,"does vastu affect tenants",n/a,20,n/a,0.00
226,"does vastu apply for flats",n/a,20,n/a,0.00
227,"does vastu matter",n/a,20,n/a,0.00
228,"does vastu shastra really work",n/a,20,n/a,0.00
229,"does vastu work in usa",n/a,20,n/a,0.00
230,"how important is vastu for flats",n/a,20,n/a,0.00
231,"how is south east direction vastu",n/a,20,n/a,0.00
232,"how is south east entrance as per vastu",n/a,20,n/a,0.01
233,"how is south east facing house in vastu",n/a,20,n/a,0.00
234,"how is south entrance as per vastu",n/a,20,n/a,0.00
235,"how many doors as per vastu in kannada",n/a,20,n/a,0.00
236,"how many fish in aquarium according to vastu shastra",n/a,20,n/a,0.00
237,"how many fish in aquarium as per vastu",n/a,20,n/a,0.00
238,"how many fish in aquarium vastu",n/a,20,n/a,0.00
239,"how many fishes in aquarium according to vastu",n/a,20,n/a,0.00
240,"how should we sleep according to vastu",n/a,20,n/a,0.00
241,"how to arrange furniture according to vastu",n/a,20,n/a,0.00
242,"how to attract customers to your shop vastu",n/a,20,n/a,0.00
243,"how to attract money as per vastu",n/a,20,n/a,0.00
244,"how to balance earth element in vastu",n/a,20,n/a,0.00
245,"how to balance vastu",n/a,20,n/a,0.00
246,"how to build a house with vastu",n/a,20,n/a,0.00
247,"how to build house according to vastu shastra",n/a,20,n/a,0.01
248,"how to build house with vastu",n/a,20,n/a,0.00
249,"how to calculate aya in vastu",n/a,20,n/a,0.00
250,"how to calculate vastu direction",n/a,20,n/a,0.00
251,"how to check direction for vastu",n/a,20,n/a,0.01
252,"how to check if house is vastu compliant",n/a,20,n/a,0.07
253,"how to check vastu dosh",n/a,20,n/a,0.03
254,"how to check vastu entrance",n/a,20,n/a,0.00
255,"how to check vastu for home",n/a,20,n/a,0.09
256,"how to check vastu of home",n/a,20,n/a,0.04
257,"how to check vastu of your house",n/a,20,n/a,0.00
258,"how to clear vastu dosh",n/a,20,n/a,0.00
259,"how to correct vastu without demolition",n/a,20,n/a,0.00
260,"how to count doors as per vastu",n/a,20,n/a,0.00
261,"how to cure vastu defects without demolition",n/a,20,n/a,0.00
262,"how to cure vastu dosh",n/a,20,n/a,0.01
263,"how to decorate bedroom according to vastu shastra",n/a,20,n/a,0.00
264,"how to decorate main door as per vastu",n/a,20,n/a,0.00
265,"how to design house as per vastu",n/a,20,n/a,0.06
266,"how to detect vastu dosh",n/a,20,n/a,0.06
267,"how to determine house facing direction vastu",n/a,20,n/a,0.01
268,"how to divide plot as per vastu between brothers",n/a,20,n/a,0.00
269,"how to do vastu pooja",n/a,20,n/a,0.00
270,"how to do vastu puja at home",n/a,20,n/a,0.00
271,"how to draw vastu chitra",n/a,20,n/a,0.00
272,"how to find brahmasthan in vastu",n/a,20,n/a,0.00
273,"how to find vastu directions",n/a,20,n/a,0.00
274,"how to fix vastu defects",n/a,20,n/a,0.00
275,"how to get rid of vastu dosh",n/a,20,n/a,0.02
276,"how to grow vastu bamboo plant",n/a,20,n/a,0.00
277,"how to grow vastu plant",n/a,20,n/a,0.00
278,"how to improve husband wife relationship through vastu",n/a,20,n/a,0.00
279,"how to improve vastu of home",n/a,20,n/a,0.00
280,"how to improve vastu of house",n/a,20,n/a,0.03
281,"how to improve vastu of south facing house",n/a,20,n/a,0.00
282,"how to increase wealth vastu",n/a,20,n/a,0.00
283,"how to install copper wire in vastu",n/a,20,n/a,0.00
284,"how to keep bed as per vastu",n/a,20,n/a,0.00
285,"how to keep lemon in water as per vastu",n/a,20,n/a,0.00
286,"how to keep tawa in kitchen according to vastu",n/a,20,n/a,0.00
287,"how to know vastu directions",n/a,20,n/a,0.04
288,"how to know vastu dosh in home",n/a,20,n/a,0.07
289,"how to know vastu of house not good",n/a,20,n/a,0.00
290,"how to learn vastu",n/a,20,n/a,0.08
291,"how to learn vastu shastra in english",n/a,20,n/a,0.00
292,"how to learn vastu shastra in hindi",n/a,20,n/a,0.09
293,"how to make house plan as per vastu",n/a,20,n/a,0.06
294,"how to make vastu grid",n/a,20,n/a,0.00
295,"how to make vastu kalash",n/a,20,n/a,0.00
296,"how to make vastu map for a house",n/a,20,n/a,0.04
297,"how to make vastu pyramid at home",n/a,20,n/a,0.00
298,"how to perform vastu pooja",n/a,20,n/a,0.00
299,"how to place almirah as per vastu",n/a,20,n/a,0.00
300,"how to place bed in bedroom as per vastu",n/a,20,n/a,0.00
301,"how to plan a house according to vastu",n/a,20,n/a,0.00
302,"how to read compass for vastu",n/a,20,n/a,0.00
303,"how to read vastu compass",n/a,20,n/a,0.00
304,"how to reduce vastu dosh",n/a,20,n/a,0.00
305,"how to remove negative energy from home vastu tips",n/a,20,n/a,0.00
306,"how to remove south west vastu dosh",n/a,20,n/a,0.00
307,"how to remove vastu dosh from home in hindi",n/a,20,n/a,0.00
308,"how to remove vastu dosh of kitchen",n/a,20,n/a,0.00
309,"how to see vastu directions",n/a,20,n/a,0.01
310,"how to see vastu for apartments",n/a,20,n/a,0.00
311,"how to see vastu for house",n/a,20,n/a,0.00
312,"how to sleep according to vastu shastra",n/a,20,n/a,0.00
313,"how to sleep by vastu shastra",n/a,20,n/a,0.00
314,"how to sleep in bedroom as per vastu shastra",n/a,20,n/a,0.01
315,"how to sleep vastu",n/a,20,n/a,0.00
316,"how to study vastu shastra",n/a,20,n/a,0.12
317,"how to use compass for vastu direction",n/a,20,n/a,0.00
318,"how to use copper wire in vastu",n/a,20,n/a,0.00
319,"how to use magnetic compass for vastu",n/a,20,n/a,0.00
320,"how to use pyramid for vastu correction",n/a,20,n/a,0.00
321,"how to use vastu compass app",n/a,20,n/a,0.00
322,"how to use vastu dosh nivaran yantra",n/a,20,n/a,0.00
323,"how to use vastu pyramid",n/a,20,n/a,0.00
324,"how to vastu for home",n/a,20,n/a,0.03
325,"how true is vastu shastra",n/a,20,n/a,0.00
326,"how vastu shastra works",n/a,20,n/a,0.00
327,"is 3 burner stove vastu",n/a,20,n/a,0.00
328,"is aloe vera good for home according to vastu",n/a,20,n/a,0.00
329,"is basement good as per vastu",n/a,20,n/a,0.00
330,"is cat good for vastu",n/a,20,n/a,0.00
331,"is dog good for vastu",n/a,20,n/a,0.00
332,"is false ceiling good as per vastu",n/a,20,n/a,0.00
333,"is flowerhorn a vastu fish",n/a,20,n/a,0.00
334,"is north east entrance good as per vastu",n/a,20,n/a,0.00
335,"is north east facing house good as per vastu",n/a,20,n/a,0.00
336,"is north entrance good as per vastu",n/a,20,n/a,0.00
337,"is north facing house good according to vastu",n/a,20,n/a,0.00
338,"is parrot good for vastu",n/a,20,n/a,0.00
339,"is pyramid vastu effective",n/a,20,n/a,0.00
340,"is rabbit good for vastu",n/a,20,n/a,0.00
341,"is running horse picture vastu",n/a,20,n/a,0.00
342,"is sliding door considered as door as per vastu",n/a,20,n/a,0.00
343,"is south east entrance good as per vastu",n/a,20,n/a,0.00
344,"is south entrance good as per vastu",n/a,20,n/a,0.00
345,"is south facing flat good for vastu",n/a,20,n/a,0.00
346,"is south west entrance good as per vastu",n/a,20,n/a,0.00
347,"is south west facing house good as per vastu",n/a,20,n/a,0.00
348,"is southeast facing house good as per vastu",n/a,20,n/a,0.00
349,"is tortoise good for vastu",n/a,20,n/a,0.00
350,"is vastu applicable for agricultural lands",n/a,20,n/a,0.00
351,"is vastu applicable for apartments",n/a,20,n/a,0.00
352,"is vastu applicable for first floor",n/a,20,n/a,0.00
353,"is vastu important",n/a,20,n/a,0.00
354,"is vastu necessary",n/a,20,n/a,0.00
355,"is vastu real or fake",n/a,20,n/a,0.00
356,"is vastu really important",n/a,20,n/a,0.00
357,"is vastu really works",n/a,20,n/a,0.00
358,"is vastu relevant today",n/a,20,n/a,0.00
359,"is vastu scientifically proven",n/a,20,n/a,0.00
360,"is vastu shastra applicable for flats",n/a,20,n/a,0.00
361,"is vastu shastra scientific",n/a,20,n/a,0.00
362,"is vastu superstition",n/a,20,n/a,0.00
363,"is vastu true or false",n/a,20,n/a,0.00
364,"is west entrance good as per vastu",n/a,20,n/a,0.00
365,"is west facing flat good as per vastu",n/a,20,n/a,0.00
366,"is west facing house good according to vastu",n/a,20,n/a,0.00
367,"should i believe in vastu",n/a,20,n/a,0.00
368,"should we believe in vastu shastra",n/a,20,n/a,0.00
369,"should we follow vastu",n/a,20,n/a,0.00
370,"should we see vastu for rented house",n/a,20,n/a,0.00
371,"what are vastu principles",n/a,20,n/a,0.00
372,"what can be kept under staircase as per vastu",n/a,20,n/a,0.00
373,"what does facing mean in vastu",n/a,20,n/a,0.00
374,"what facing house is the best as per vastu",n/a,20,n/a,0.00
375,"what is aaya in vastu",n/a,20,n/a,0.00
376,"what is best sleeping direction according to vastu",n/a,20,n/a,0.00
377,"what is brahmasthan in vastu",n/a,20,n/a,0.00
378,"what is eesanyam in vastu",n/a,20,n/a,0.00
379,"what is feng shui vastu",n/a,20,n/a,0.00
380,"what is helix in vastu",n/a,20,n/a,0.00
381,"what is north east corner in vastu",n/a,20,n/a,0.00
382,"what is north east cut vastu",n/a,20,n/a,0.00
383,"what is pada in vastu",n/a,20,n/a,0.00
384,"what is road hit in vastu",n/a,20,n/a,0.00
385,"what is the meaning of vastu in english",n/a,20,n/a,0.00
386,"what is the meaning of vastu in hindi",n/a,20,n/a,0.00
387,"what is the meaning of vastu shastra",n/a,20,n/a,0.00
388,"what is the vastu for a north facing house",n/a,20,n/a,0.00
389,"what is vastu called in english",n/a,20,n/a,0.00
390,"what is vastu compliant",n/a,20,n/a,0.00
391,"what is vastu day",n/a,20,n/a,0.00
392,"what is vastu dosha",n/a,20,n/a,0.00
393,"what is vastu for house",n/a,20,n/a,0.00
394,"what is vastu in hindi",n/a,20,n/a,0.00
395,"what is vastu naal",n/a,20,n/a,0.00
396,"what is vastu pooja",n/a,20,n/a,0.00
397,"what is vastu puja",n/a,20,n/a,0.00
398,"what is vastu science",n/a,20,n/a,0.00
399,"what is vastu shanti puja",n/a,20,n/a,0.00
400,"what is vastu shastra for home",n/a,20,n/a,0.00
401,"what is vastu vihar",n/a,20,n/a,0.00
402,"what should be the colour of bedroom according to vastu",n/a,20,n/a,0.00
403,"what should be the direction of toilet according to vastu",n/a,20,n/a,0.00
404,"what should be the direction of toilet as per vastu",n/a,20,n/a,0.01
405,"what to do if house is not as per vastu",n/a,20,n/a,0.00
406,"what to keep under stairs as per vastu",n/a,20,n/a,0.00
407,"what vastu shastra",n/a,20,n/a,0.00
408,"what we say vastu in english",n/a,20,n/a,0.00
409,"what's vastu",n/a,20,n/a,0.00
410,"where did vastu come from",n/a,20,n/a,0.00
411,"where kitchen should be as per vastu",n/a,20,n/a,0.00
412,"where should aquarium be placed according to vastu",n/a,20,n/a,0.00
413,"where should bathroom be as per vastu",n/a,20,n/a,0.00
414,"where should be bathroom according to vastu",n/a,20,n/a,0.00
415,"where should be bedroom as per vastu",n/a,20,n/a,0.01
416,"where should be kitchen according to vastu",n/a,20,n/a,0.01
417,"where should be kitchen sink as per vastu",n/a,20,n/a,0.00
418,"where should be mandir in house according to vastu",n/a,20,n/a,0.00
419,"where should be septic tank as per vastu",n/a,20,n/a,0.00
420,"where should be staircase as per vastu",n/a,20,n/a,0.00
421,"where should be the bathroom as per vastu",n/a,20,n/a,0.00
422,"where should be the bedroom as per vastu",n/a,20,n/a,0.01
423,"where should be the pooja room as per vastu",n/a,20,n/a,0.01
424,"where should be the septic tank as per vastu",n/a,20,n/a,0.00
425,"where should be the temple as per vastu",n/a,20,n/a,0.00
426,"where should be toilet according to vastu",n/a,20,n/a,0.00
427,"where should bed be placed in room according to vastu",n/a,20,n/a,0.00
428,"where should calendar be placed as per vastu",n/a,20,n/a,0.00
429,"where should i sit in office as per vastu",n/a,20,n/a,0.00
430,"where should kitchen be according to vastu",n/a,20,n/a,0.00
431,"where should the clock be placed as per vastu",n/a,20,n/a,0.01
432,"where should the kitchen be as per vastu",n/a,20,n/a,0.01
433,"where should the toilet be according to vastu",n/a,20,n/a,0.00
434,"where should tv be placed as per vastu",n/a,20,n/a,0.00
435,"where should wall clock be placed as per vastu",n/a,20,n/a,0.01
436,"where should we keep medicines as per vastu",n/a,20,n/a,0.00
437,"where should we place mirror as per vastu",n/a,20,n/a,0.01
438,"where should we place wall clock according to vastu",n/a,20,n/a,0.01
439,"where the kitchen should be as per vastu",n/a,20,n/a,0.00
440,"where to bury vastu purusha",n/a,20,n/a,0.00
441,"where to hang clock according to vastu",n/a,20,n/a,0.00
442,"where to hang family pictures as per vastu",n/a,20,n/a,0.00
443,"where to hang god photos as per vastu",n/a,20,n/a,0.00
444,"where to hang key holder as per vastu",n/a,20,n/a,0.00
445,"where to hang wall clock according to vastu",n/a,20,n/a,0.00
446,"where to keep almirah in bedroom as per vastu",n/a,20,n/a,0.00
447,"where to keep aquarium in home as per vastu",n/a,20,n/a,0.00
448,"where to keep aquarium in house according to vastu",n/a,20,n/a,0.00
449,"where to keep aquarium in office according to vastu",n/a,20,n/a,0.00
450,"where to keep awards as per vastu",n/a,20,n/a,0.00
451,"where to keep bed in bedroom as per vastu",n/a,20,n/a,0.01
452,"where to keep bookshelf according to vastu",n/a,20,n/a,0.00
453,"where to keep brass tortoise at home according to vastu",n/a,20,n/a,0.00
