#,Keyword,Intent,Volume,KD %,CPC (USD)
872,"can we compromise stairs direction as per vastu",n/a,0,n/a,0.00
873,"can we cook facing north east as per vastu",n/a,0,n/a,0.00
874,"can we cook food facing west as per vastu",n/a,0,n/a,0.00
875,"can we cut coconut tree according to vastu",n/a,0,n/a,0.00
876,"can we do puja on every vastu day",n/a,0,n/a,0.00
877,"can we exchange rings looking towards north vastu",n/a,0,n/a,0.00
878,"can we extend north west corner as per the vastu",n/a,0,n/a,0.00
879,"can we extend portico pillar towsrds northeast according to vastu",n/a,0,n/a,0.00
880,"can we fix single door window as per vastu",n/a,0,n/a,0.00
881,"can we give lemon vastu",n/a,0,n/a,0.00
882,"can we grow methi at home according to vastu",n/a,0,n/a,0.00
883,"can we grow pomegranate in home according to vastu",n/a,0,n/a,0.00
884,"can we hang vastu mirror in stairs",n/a,0,n/a,0.00
885,"can we have bathroom in southeast corner according to vastu",n/a,0,n/a,0.00
886,"can we have butterfly stickrs in bedroom as per vastu",n/a,0,n/a,0.00
887,"can we have exhaust fan on west side kitchen vastu",n/a,0,n/a,0.00
888,"can we have peacock stickers as per vastu",n/a,0,n/a,0.00
889,"can we have sewarage pipe in nort east wall vastu",n/a,0,n/a,0.00
890,"can we have sump below living room as per vastu",n/a,0,n/a,0.00
891,"can we have sump under living room as per vastu",n/a,0,n/a,0.00
892,"can we have thorns plant vastu",n/a,0,n/a,0.00
893,"can we have two puja rooms in one house vastu",n/a,0,n/a,0.00
894,"can we have wardrobes on west wall as per vastu",n/a,0,n/a,0.00
895,"can we keep 3 fishes in aquarium according to vastu",n/a,0,n/a,0.00
896,"can we keep 6 fishes in aquarium according to vastu",n/a,0,n/a,0.00
897,"can we keep almara in northwest as per vastu",n/a,0,n/a,0.00
898,"can we keep almira at northeast as per vastu",n/a,0,n/a,0.00
899,"can we keep almirah at northeast as per vastu",n/a,0,n/a,0.00
900,"can we keep anything on the locker as per vastu",n/a,0,n/a,0.00
901,"can we keep beerwa in northwest as per vastu",n/a,0,n/a,0.00
902,"can we keep cat at home as per vastu",n/a,0,n/a,0.00
903,"can we keep gold in bed as per vastu",n/a,0,n/a,0.00
904,"can we keep krishna arjun rath as per vastu",n/a,0,n/a,0.00
905,"can we keep krishna arjun rath idol as per vastu",n/a,0,n/a,0.00
906,"can we keep kuber idol vastu",n/a,0,n/a,0.00
907,"can we keep palm plant at home according to vastu",n/a,0,n/a,0.00
908,"can we keep sofa in bedroom vastu",n/a,0,n/a,0.00
909,"can we keep trident at home vastu",n/a,0,n/a,0.00
910,"can we keep tv under stairs as per vastu",n/a,0,n/a,0.00
911,"can we keep vastu bamboo plant in north east corner",n/a,0,n/a,0.00
912,"can we keep vastu shanti on ganesh chaturthi",n/a,0,n/a,0.00
913,"can we keep vastu shanti on ganesh chutarthi",n/a,0,n/a,0.00
914,"can we pay rent on friday as per vastu",n/a,0,n/a,0.00
915,"can we place staircase on nw as per vastu",n/a,0,n/a,0.00
916,"can we provide toilet in south east according to vastu",n/a,0,n/a,0.00
917,"can we purchase wardrobe with mirror vastu",n/a,0,n/a,0.00
918,"can we put a clock in toilet as per vastu",n/a,0,n/a,0.00
919,"can we put a mirror in front of bed vastu",n/a,0,n/a,0.00
920,"can we put grey color in home vastu",n/a,0,n/a,0.00
921,"can we put grey colours in home vastu",n/a,0,n/a,0.00
922,"can we put li point vastu west",n/a,0,n/a,0.00
923,"can we put money plant in east or north vastu",n/a,0,n/a,0.00
924,"can we put sapota tree in factory as per vastu",n/a,0,n/a,0.00
925,"can we put vastu yantra at home",n/a,0,n/a,0.00
926,"can we sell gold fish as per vastu",n/a,0,n/a,0.00
927,"can we sell vastu vihar",n/a,0,n/a,0.00
928,"can we sleep in the office as per vastu",n/a,0,n/a,0.00
929,"can we stick pyra vastu pyramid near the entrance",n/a,0,n/a,0.00
930,"can we store above the headrest according to vastu",n/a,0,n/a,0.00
931,"can we take red chillys from some one vastu",n/a,0,n/a,0.00
932,"can we use apple green granite countertops in kitchen vastu",n/a,0,n/a,0.00
933,"can we use clock and photo as per vastu",n/a,0,n/a,0.00
934,"can we use glass for home according to vastu",n/a,0,n/a,0.00
935,"can we use gopurams pooja room accordi g to vastu",n/a,0,n/a,0.00
936,"can we use granite on kitchen slab in vastu",n/a,0,n/a,0.00
937,"can we use maroon curtains in bedroom according to vastu",n/a,0,n/a,0.00
938,"can we use open to sky in vastu",n/a,0,n/a,0.00
939,"can we use ots in vastu",n/a,0,n/a,0.00
940,"can window door window be placed straight per vastu",n/a,0,n/a,0.00
941,"can window present in south west corner vastu",n/a,0,n/a,0.00
942,"can you grow echeveria as per vastu",n/a,0,n/a,0.00
943,"can you grow livistona as per vastu",n/a,0,n/a,0.00
944,"can you have toilet in south weat part vastu",n/a,0,n/a,0.00
945,"can you put bed under window according to vastu",n/a,0,n/a,0.00
946,"do americans beleive in vastu",n/a,0,n/a,0.00
947,"do americans check vastu shastra before making home",n/a,0,n/a,0.00
948,"do bohras follow vastu shashtra",n/a,0,n/a,0.00
949,"do crystal help in vastu",n/a,0,n/a,0.00
950,"do hanso ka joda vastu",n/a,0,n/a,0.00
951,"do mukhi ghar vastu pashchim",n/a,0,n/a,0.00
952,"do muslims see vastu",n/a,0,n/a,0.00
953,"do punjabis believe in vastu",n/a,0,n/a,0.00
954,"do sikhs believe in vastu shastra",n/a,0,n/a,0.00
955,"do vastu complaints in ground floor affects first floor",n/a,0,n/a,0.00
956,"do vastu required for office employer seat",n/a,0,n/a,0.00
957,"do we consider bathroom door as door in vastu",n/a,0,n/a,0.00
958,"do we need an exit door as per vastu",n/a,0,n/a,0.00
959,"do we need to follow 100 percent vastu",n/a,0,n/a,0.00
960,"do we.need to put something on a wall.as.per vastu",n/a,0,n/a,0.00
961,"do westerners follow vastu",n/a,0,n/a,0.00
962,"do ya do se adhik kisi vyakti vastu",n/a,0,n/a,0.00
963,"do you believe in vastu",n/a,0,n/a,0.00
964,"do you believe in vastu shastra",n/a,0,n/a,0.00
965,"does a kitchen room be big according to vastu shastra",n/a,0,n/a,0.00
966,"does americans follow vastu shastra",n/a,0,n/a,0.00
967,"does bad vastu affect house owner",n/a,0,n/a,0.00
968,"does bird affect vastu",n/a,0,n/a,0.00
969,"does changing room of sleeping make a difference in vastu",n/a,0,n/a,0.00
970,"does christians believe in vastu",n/a,0,n/a,0.00
971,"does colors has any value in vastu",n/a,0,n/a,0.00
972,"does colour has any value in vastu",n/a,0,n/a,0.00
973,"does cow and calf pooja help in overcoming vastu challenges",n/a,0,n/a,0.00
974,"does crystal ball work in vastu shastra",n/a,0,n/a,0.00
975,"does csm vastu sagralaya mumbai have section on kurla history",n/a,0,n/a,0.00
976,"does dwarf coconut variety good to plant according to vastu",n/a,0,n/a,0.00
977,"does facing west in an office bring bad luck vastu",n/a,0,n/a,0.00
978,"does fatherinlaw house vastu effect son inlaw",n/a,0,n/a,0.00
979,"does feng shui and vastu work",n/a,0,n/a,0.00
980,"does following vastu at home makes any difference",n/a,0,n/a,0.00
981,"does gravity effect vastu",n/a,0,n/a,0.00
982,"does home vastu reflects business",n/a,0,n/a,0.00
983,"does house vastu matter",n/a,0,n/a,0.00
984,"does no of corners affect vastu",n/a,0,n/a,0.00
985,"does north west gateway for house good as per vastu",n/a,0,n/a,0.00
986,"does old vastu required vastupuja",n/a,0,n/a,0.00
987,"does people see vastu in rent houses",n/a,0,n/a,0.00
988,"does prestige lakeside follow vastu",n/a,0,n/a,0.00
989,"does red color help in south east vastu dosh",n/a,0,n/a,0.00
990,"does sikhism believe in vastu shastra",n/a,0,n/a,0.00
991,"does spiral staircase good or bad for vastu",n/a,0,n/a,0.00
992,"does vastu affect daily life",n/a,0,n/a,0.00
993,"does vastu affect on 2nd floor",n/a,0,n/a,0.00
994,"does vastu apllies to rented house",n/a,0,n/a,0.00
995,"does vastu dosha apply to tenants",n/a,0,n/a,0.00
996,"does vastu faults affect the b",n/a,0,n/a,0.00
997,"does vastu faults affect the owner or tenants",n/a,0,n/a,0.00
998,"does vastu hfc have office in pune",n/a,0,n/a,0.00
999,"does vastu permit growing a chilie plant at home",n/a,0,n/a,0.00
1000,"does vastu puja for buying old home",n/a,0,n/a,0.00
1001,"does vastu puja remedies vastu",n/a,0,n/a,0.00
1002,"does vastu really exists",n/a,0,n/a,0.00
1003,"does vastu really matters",n/a,0,n/a,0.00
1004,"does vastu remedies work",n/a,0,n/a,0.00
1005,"does vastu tell you not to use marble in reception",n/a,0,n/a,0.00
1006,"does vastu work above ground floor",n/a,0,n/a,0.00
1007,"does vastu yantra work",n/a,0,n/a,0.00
1008,"don't believe vastu",n/a,0,n/a,0.00
1009,"don't give red chilli to any one vastu",n/a,0,n/a,0.00
1010,"don't keep salt and turmeric together vastu",n/a,0,n/a,0.00
1011,"don't leave your footwear here vastu shastra",n/a,0,n/a,0.00
1012,"has vastu to be followed for firstfloor building",n/a,0,n/a,0.00
1013,"have also knowledge about vastu",n/a,0,n/a,0.00
1014,"how ancient temples built with vastu",n/a,0,n/a,0.00
1015,"how and where to keep live vastu tortoise at home",n/a,0,n/a,0.00
1016,"how bad time can be removed by vastu",n/a,0,n/a,0.00
1017,"how big of a role do colours play in vastu",n/a,0,n/a,0.00
1018,"how book a flat in vastu bihar",n/a,0,n/a,0.00
1019,"how brahmasthan be decorated according to vastu",n/a,0,n/a,0.00
1020,"how can find it flat rooms which sides in vastu",n/a,0,n/a,0.00
1021,"how can home facein diside for best vastu",n/a,0,n/a,0.00
1022,"how can i check my name thru vastu",n/a,0,n/a,0.00
1023,"how can i clear vastu dosh of dark room",n/a,0,n/a,0.00
1024,"how can i found the true direction according vastu",n/a,0,n/a,0.00
1025,"how can increase memory according vastu",n/a,0,n/a,0.00
1026,"how can sleep as per vastu shastra",n/a,0,n/a,0.00
1027,"how can we name of our house vastu shastra",n/a,0,n/a,0.00
1028,"how check vastu of home 25 21",n/a,0,n/a,0.00
1029,"how copperwire used to vastu",n/a,0,n/a,0.00
1030,"how do i know my house vastu",n/a,0,n/a,0.00
1031,"how do successful people look at vastu",n/a,0,n/a,0.00
1032,"how do we consider vastu directions",n/a,0,n/a,0.00
1033,"how do you calculate center of house in vastu",n/a,0,n/a,0.00
1034,"how do you determine vastu for an apartment",n/a,0,n/a,0.00
1035,"how do you say vastu shilpi in english",n/a,0,n/a,0.00
1036,"how does one understand the vastu of an apartment",n/a,0,n/a,0.00
1037,"how does pyramid vastu work",n/a,0,n/a,0.00
1038,"how does vastu defect can affect one's life",n/a,0,n/a,0.00
1039,"how does vastu delay a daughter's marriage",n/a,0,n/a,0.00
1040,"how does vastu in room work",n/a,0,n/a,0.00
1041,"how effective it is to keep a aquarium in vastu",n/a,0,n/a,0.00
1042,"how good vastu waking days",n/a,0,n/a,0.00
1043,"how is 8 grid measured for vastu direction",n/a,0,n/a,0.00
1044,"how is buddha connected to vastu",n/a,0,n/a,0.00
1045,"how is extension calculated as per vastu",n/a,0,n/a,0.00
1046,"how is extension in nnw as per vastu",n/a,0,n/a,0.00
1047,"how is extension in north north west as per vastu",n/a,0,n/a,0.00
1048,"how is flat entry direction decided vastu",n/a,0,n/a,0.00
1049,"how is flat no 104 as per vastu",n/a,0,n/a,0.00
1050,"how is house placement dedicded by vastu",n/a,0,n/a,0.00
1051,"how is kerala vastu different",n/a,0,n/a,0.00
1052,"how is north west balcony vastu",n/a,0,n/a,0.00
1053,"how is south east door as per vastu",n/a,0,n/a,0.00
1054,"how is south east facing in vastu",n/a,0,n/a,0.00
1055,"how is south east facing office as per vastu",n/a,0,n/a,0.00
1056,"how is south west facing flat vastu",n/a,0,n/a,0.00
1057,"how is southeast facing house in vastu",n/a,0,n/a,0.00
1058,"how is the vastu of a home malayalam",n/a,0,n/a,0.00
1059,"how is vastu and astrology connected",n/a,0,n/a,0.00
1060,"how is vastu as per astrological chart calculated",n/a,0,n/a,0.00
1061,"how is vastu if south east is extended",n/a,0,n/a,0.00
1062,"how is vastu important in one's life",n/a,0,n/a,0.00
1063,"how is vastu kala academy for b arch",n/a,0,n/a,0.00
1064,"how is vastu purusha mandala and five elements related",n/a,0,n/a,0.00
1065,"how is vastu vihar bungalow",n/a,0,n/a,0.00
1066,"how long does it take to perform vastu shastra",n/a,0,n/a,0.00
1067,"how long will take effect vastu remedy",n/a,0,n/a,0.00
1068,"how maney drawings can be made as per vastu",n/a,0,n/a,0.00
1069,"how maney pillars vastu",n/a,0,n/a,0.00
1070,"how many children i will have in future vastu",n/a,0,n/a,0.00
1071,"how many days after effect of vastu piramid",n/a,0,n/a,0.00
1072,"how many days to hang ash gourd from vastu puja",n/a,0,n/a,0.00
1073,"how many divisions of house according to vastu",n/a,0,n/a,0.00
1074,"how many door in vastu",n/a,0,n/a,0.00
1075,"how many door vastu",n/a,0,n/a,0.00
1076,"how many doors are good for house in vastu",n/a,0,n/a,0.00
1077,"how many doors as per vastu telugu",n/a,0,n/a,0.00
1078,"how many doors in a house vastu",n/a,0,n/a,0.00
1079,"how many doors in vastu shastram",n/a,0,n/a,0.00
1080,"how many doors vastu",n/a,0,n/a,0.00
1081,"how many earn vastu",n/a,0,n/a,0.00
1082,"how many earn vastu in india",n/a,0,n/a,0.00
1083,"how many entrances are good in home according to vastu",n/a,0,n/a,0.00
1084,"how many fish good in tank as per vastu",n/a,0,n/a,0.00
1085,"how many fishes according to vastu",n/a,0,n/a,0.00
1086,"how many fishes according to vastu less than 6",n/a,0,n/a,0.00
1087,"how many fishes in small aquarium according to vastu",n/a,0,n/a,0.00
1088,"how many flutes on beam for vastu",n/a,0,n/a,0.00
1089,"how many gadapa in house as per vastu",n/a,0,n/a,0.00
1090,"how many gods are in outer part of vastu purusha",n/a,0,n/a,0.00
1091,"how many goldfish are required according to vastu",n/a,0,n/a,0.00
1092,"how many goldfish are required for good vastu",n/a,0,n/a,0.00
1093,"how many goldfish can drop in tank according to vastu",n/a,0,n/a,0.00
1094,"how many horses in vastu",n/a,0,n/a,0.00
1095,"how many minnows as per vastu",n/a,0,n/a,0.00
1096,"how many no of column as per vastu",n/a,0,n/a,0.00
1097,"how many number of doors and windows as per vastu",n/a,0,n/a,0.00
1098,"how many sides in a room as per vastu",n/a,0,n/a,0.00
1099,"how many stairs in house vastu sastra",n/a,0,n/a,0.00
1100,"how many steps add nober as per vastu",n/a,0,n/a,0.00
1101,"how many steps add number or as per vastu",n/a,0,n/a,0.00
1102,"how many steps are good for business vastu",n/a,0,n/a,0.00
1103,"how many steps entrance as per vastu",n/a,0,n/a,0.00
1104,"how many steps entrance of a house vastu malayalam",n/a,0,n/a,0.00
1105,"how many steps front entrance as per vastu",n/a,0,n/a,0.00
1106,"how many steps in entrance are good for business vastu",n/a,0,n/a,0.00
1107,"how many steps in pati vastu",n/a,0,n/a,0.00
1108,"how many steps staircase for home vastu",n/a,0,n/a,0.00
1109,"how many steps to keep in staircase as per vastu",n/a,0,n/a,0.00
1110,"how many stick in vastu bamboo plant",n/a,0,n/a,0.00
1111,"how many swastiks in main gate vastu",n/a,0,n/a,0.00
1112,"how many types of vedhe pottu in telugu vastu",n/a,0,n/a,0.00
1113,"how many windows in a room as per vastu",n/a,0,n/a,0.00
1114,"how many windows required as vastu",n/a,0,n/a,0.00
1115,"how many windows vastu",n/a,0,n/a,0.00
1116,"how morepankh helps in vastu",n/a,0,n/a,0.00
1117,"how much deepth should i keep for vasakal vastu",n/a,0,n/a,0.00
1118,"how much depth should i keep for vasakal vastu",n/a,0,n/a,0.00
1119,"how much does vastu matter",n/a,0,n/a,0.00
1120,"how much fate of person depends on vastu shastra",n/a,0,n/a,0.00
1121,"how much feet good for vastu entrance",n/a,0,n/a,0.00
1122,"how much is vastu shastra is real",n/a,0,n/a,0.00
1123,"how much time vastu puja",n/a,0,n/a,0.00
1124,"how much to believe in vastu shastra",n/a,0,n/a,0.00
1125,"how much to rely on vastu",n/a,0,n/a,0.00
1126,"how my bedroom should be according to vastu",n/a,0,n/a,0.00
1127,"how north facing toilet vastu",n/a,0,n/a,0.00
1128,"how place temple according to vastu",n/a,0,n/a,0.00
1129,"how protect house through vastu dosh",n/a,0,n/a,0.00
1130,"how protect house through vastu dosh in hindi",n/a,0,n/a,0.00
1131,"how real is vastu shastra",n/a,0,n/a,0.00
1132,"how reliable is vastu shastra",n/a,0,n/a,0.00
1133,"how ro check vastu directions of a flat",n/a,0,n/a,0.00
1134,"how set bed room by vastu",n/a,0,n/a,0.00
1135,"how set kitchen room by vastu",n/a,0,n/a,0.00
1136,"how set room by vastu",n/a,0,n/a,0.00
1137,"how should a room be decorated according to vastu",n/a,0,n/a,0.00
1138,"how should bathroom in vastu",n/a,0,n/a,0.00
1139,"how should be a house according to vastu",n/a,0,n/a,0.00
1140,"how should be a signaure according to vastu",n/a,0,n/a,0.00
1141,"how should be a three room house on vastu basis",n/a,0,n/a,0.00
1142,"how should be bathroom and bedroom as per vastu",n/a,0,n/a,0.00
1143,"how should be mandir odil be placed as per vastu",n/a,0,n/a,0.00
1144,"how should be our shop front by vastu",n/a,0,n/a,0.00
1145,"how should be the flat according to vastu",n/a,0,n/a,0.00
1146,"how should broom vastu be kept",n/a,0,n/a,0.00
1147,"how should door open vastu video",n/a,0,n/a,0.00
1148,"how should the flat be as per vastu",n/a,0,n/a,0.00
1149,"how should vastu purush installed and in which cornee",n/a,0,n/a,0.00
1150,"how sleep vastu shastra in telugu",n/a,0,n/a,0.00
1151,"how the planets affects vastu directions",n/a,0,n/a,0.00
1152,"how the vastu for kitchen and bedroom",n/a,0,n/a,0.00
1153,"how the vastu for two rooms",n/a,0,n/a,0.00
1154,"how ti make vastu yantram at home telugu",n/a,0,n/a,0.00
1155,"how to activate 45 energy fields of vastu purush mandal",n/a,0,n/a,0.00
1156,"how to activate power of 45 devta in vastu",n/a,0,n/a,0.00
1157,"how to add vastu to cad",n/a,0,n/a,0.00
1158,"how to apply for job in austrelia as vastu condultant",n/a,0,n/a,0.00
1159,"how to apply for vastu kala academy admission",n/a,0,n/a,0.00
1160,"how to apply vastu stala certificate",n/a,0,n/a,0.00
1161,"how to arrange drawing room furniture as per vastu",n/a,0,n/a,0.00
1162,"how to arrange house according to vastu",n/a,0,n/a,0.00
1163,"how to arrange house as per vastu",n/a,0,n/a,0.00
1164,"how to arrange your room vastu",n/a,0,n/a,0.00
1165,"how to attange things in house by vastu",n/a,0,n/a,0.00
1166,"how to attract money by vastu",n/a,0,n/a,0.00
1167,"how to avoid bad dreams at night according to vastu",n/a,0,n/a,0.00
1168,"how to avoid fighting at home according to vastu",n/a,0,n/a,0.00
1169,"how to balance earth zone in vastu",n/a,0,n/a,0.00
1170,"how to balance nairuthi moola cut in vastu",n/a,0,n/a,0.00
1171,"how to balance your vastu zone",n/a,0,n/a,0.00
1172,"how to become a vastu expert",n/a,0,n/a,0.00
1173,"how to become rich vastu",n/a,0,n/a,0.00
1174,"how to become vastu specialist",n/a,0,n/a,0.00
1175,"how to bed room cot arrange as per vastu",n/a,0,n/a,0.00
1176,"how to block negative energy from bathrooms as per vastu",n/a,0,n/a,0.00
1177,"how to block wrong entrance in vastu shastra",n/a,0,n/a,0.00
1178,"how to born a baby boy vastu",n/a,0,n/a,0.00
1179,"how to build a vastu house",n/a,0,n/a,0.00
1180,"how to build house according to vastu shastra in telugu",n/a,0,n/a,0.00
1181,"how to build house with vastu shashtra",n/a,0,n/a,0.00
1182,"how to build new house as per vastu",n/a,0,n/a,0.00
1183,"how to bury vastu purusha",n/a,0,n/a,0.00
1184,"how to buy land vastu",n/a,0,n/a,0.00
1185,"how to buy land vastu tamil",n/a,0,n/a,0.00
1186,"how to buy vastu wind chimes",n/a,0,n/a,0.00
1187,"how to cakculate padhas in house vastu",n/a,0,n/a,0.00
1188,"how to calculate 16 directions in vastu",n/a,0,n/a,0.00
1189,"how to calculate 4th pada in vastu",n/a,0,n/a,0.00
1190,"how to calculate aaya for vastu",n/a,0,n/a,0.00
1191,"how to calculate aaya vyaya according to vastu",n/a,0,n/a,0.00
1192,"how to calculate aaya vyaya according to vastu free online",n/a,0,n/a,0.00
1193,"how to calculate aya for vastu",n/a,0,n/a,0.00
1194,"how to calculate ayadi for vastu",n/a,0,n/a,0.00
1195,"how to calculate best date for delivery as per vastu",n/a,0,n/a,0.00
1196,"how to calculate brahmasthan of rectangular plot in vastu",n/a,0,n/a,0.00
1197,"how to calculate centre point of a triangle plane vastu",n/a,0,n/a,0.00
1198,"how to calculate directions in vastu",n/a,0,n/a,0.00
1199,"how to calculate pada in vastu shastra",n/a,0,n/a,0.00
1200,"how to calculate perimeter of a building as per vastu",n/a,0,n/a,0.00
1201,"how to calculate room size as per vastu in malayalam",n/a,0,n/a,0.00
1202,"how to calculate room size as per vastu in tamil",n/a,0,n/a,0.00
1203,"how to calculate room size as per vastu pdf",n/a,0,n/a,0.00
1204,"how to calculate the cardinal directions in vastu with degrees",n/a,0,n/a,0.00
1205,"how to calculate the stage of veedu in vastu",n/a,0,n/a,0.00
1206,"how to calculate vastu consultancy fees",n/a,0,n/a,0.00
1207,"how to calculate vastu direction in telugu",n/a,0,n/a,0.00
1208,"how to calculate yama sutra as per vastu",n/a,0,n/a,0.00
1209,"how to calculation vastu aya in kannada",n/a,0,n/a,0.00
1210,"how to calculation vastu perimeter",n/a,0,n/a,0.00
1211,"how to change vastu of oval shape dining table",n/a,0,n/a,0.00
1212,"how to change vastu of shop",n/a,0,n/a,0.00
1213,"how to change wrong vastu to right",n/a,0,n/a,0.00
1214,"how to check basic vastu of a flat",n/a,0,n/a,0.00
1215,"how to check direction in vastu",n/a,0,n/a,0.00
1216,"how to check direction of flat vastu",n/a,0,n/a,0.00
1217,"how to check directions as per vastu",n/a,0,n/a,0.00
1218,"how to check flat vastu energy before buying",n/a,0,n/a,0.00
1219,"how to check history of plot in vastu shastra",n/a,0,n/a,0.00
1220,"how to check house number as per vastu",n/a,0,n/a,0.00
1221,"how to check office vastu",n/a,0,n/a,0.00
1222,"how to check room vastu directions in a flat",n/a,0,n/a,0.00
1223,"how to check the directions in vastu using computer",n/a,0,n/a,0.00
1224,"how to check the vastu for main door",n/a,0,n/a,0.00
1225,"how to check the vastu is positive or not",n/a,0,n/a,0.00
1226,"how to check vastu direction for kitchen",n/a,0,n/a,0.00
1227,"how to check vastu energy",n/a,0,n/a,0.00
1228,"how to check vastu for house agni moole",n/a,0,n/a,0.00
1229,"how to check vastu of my flat",n/a,0,n/a,0.00
1230,"how to check vastu of ur room",n/a,0,n/a,0.00
1231,"how to check vastu score card",n/a,0,n/a,0.00
1232,"how to check what is my vastu shastra",n/a,0,n/a,0.00
1233,"how to choose a house with good vastu",n/a,0,n/a,0.00
1234,"how to choose agricultural land as per vastu",n/a,0,n/a,0.00
1235,"how to choose colour for home vastu",n/a,0,n/a,0.00
1236,"how to choose kitchen stone for vastu shadtra",n/a,0,n/a,0.00
1237,"how to choose the best colors for drawing room vastu",n/a,0,n/a,0.00
1238,"how to choose vastu colors",n/a,0,n/a,0.00
1239,"how to choose wallet as per vastu",n/a,0,n/a,0.00
1240,"how to chrge for vastu visit",n/a,0,n/a,0.00
1241,"how to clean home with mop in vastu",n/a,0,n/a,0.00
1242,"how to clear out debts according to vastu",n/a,0,n/a,0.00
1243,"how to clear vastu dosh by rudraksha",n/a,0,n/a,0.00
1244,"how to clear vastu dosh in hindi",n/a,0,n/a,0.00
1245,"how to clear vastu dosh with rudraksha",n/a,0,n/a,0.00
1246,"how to collect clinet for vastu client tips",n/a,0,n/a,0.00
1247,"how to color use in vastu",n/a,0,n/a,0.00
1248,"how to combine family according to vastu",n/a,0,n/a,0.00
1249,"how to compensate vastu dosh of a toilet",n/a,0,n/a,0.00
1250,"how to compound wall height vastu",n/a,0,n/a,0.00
1251,"how to construct a house as per vastu",n/a,0,n/a,0.00
1252,"how to construct a house with vastu",n/a,0,n/a,0.00
1253,"how to construct a north facing plot as per vastu",n/a,0,n/a,0.00
1254,"how to construct home with vastu",n/a,0,n/a,0.00
1255,"how to contact machiraju venugopal vastu",n/a,0,n/a,0.00
1256,"how to control hot tempered husband through vastu tips",n/a,0,n/a,0.00
1257,"how to control husband by vastu shastra",n/a,0,n/a,0.00
1258,"how to control vastu dosh",n/a,0,n/a,0.00
1259,"how to control vastu dosh in house",n/a,0,n/a,0.00
1260,"how to convert bill land to vastu land",n/a,0,n/a,0.00
1261,"how to convert land from danga to vastu",n/a,0,n/a,0.00
1262,"how to convert land title from danga to vastu",n/a,0,n/a,0.00
1263,"how to convert sali land to vastu land",n/a,0,n/a,0.00
1264,"how to convert vastu from danga",n/a,0,n/a,0.00
1265,"how to correct 24 feet vastu",n/a,0,n/a,0.00
1266,"how to correct bhallat dev in vastu",n/a,0,n/a,0.00
1267,"how to correct even number of steps as per vastu",n/a,0,n/a,0.00
1268,"how to correct fault vastu",n/a,0,n/a,0.00
1269,"how to correct irregular interior space as per vastu",n/a,0,n/a,0.00
1270,"how to correct irregular interior space asper vastu",n/a,0,n/a,0.00
1271,"how to correct missing north in vastu",n/a,0,n/a,0.00
1272,"how to correct room size as per vastu",n/a,0,n/a,0.00
1273,"how to correct the extended corner of the vastu",n/a,0,n/a,0.00
1274,"how to correct vastu defect of bathroom in north east",n/a,0,n/a,0.00
1275,"how to correct vastu defects for bathrooms",n/a,0,n/a,0.00
1276,"how to correct vastu dosh of north east corner",n/a,0,n/a,0.00
1277,"how to correct vastu dosh with braking house youtube hindi",n/a,0,n/a,0.00
1278,"how to correct vastu if your door is facing west",n/a,0,n/a,0.00
1279,"how to correct vastu kitchen in north east",n/a,0,n/a,0.00
1280,"how to correct vastu of office",n/a,0,n/a,0.00
1281,"how to correct vastu without physical changes",n/a,0,n/a,0.00
1282,"how to correlate household items with vastu",n/a,0,n/a,0.00
1283,"how to count number of windows as per vastu",n/a,0,n/a,0.00
1284,"how to count steps in vastu",n/a,0,n/a,0.00
1285,"how to count vastu pada",n/a,0,n/a,0.00
1286,"how to cover up a mirror vastu",n/a,0,n/a,0.00
1287,"how to crate bhrama sky open space vastu",n/a,0,n/a,0.00
1288,"how to create a good energy space according to vastu",n/a,0,n/a,0.00
1289,"how to create creative design in wordpress for vastu",n/a,0,n/a,0.00
1290,"how to create invitationcard for vastu pujan",n/a,0,n/a,0.00
1291,"how to create space tatya vastu",n/a,0,n/a,0.00
1292,"how to cure kitchen vastu with colored stripes",n/a,0,n/a,0.00
1293,"how to cure kitchen vastu with patti",n/a,0,n/a,0.00
